,title,subreddit,words_in_sentence
2600,Best Iced Coffee/Latte/Macchiato That Won’t Kill Me With Sugar But Is Also Not Too Strong,DunkinDonuts,18
2601,No more hazelnut,DunkinDonuts,3
2602,No more hazelnut??????? End of world??????,DunkinDonuts,6
2603,Any hiring managers here?,DunkinDonuts,4
2604,What Cream does Dunkin use?,DunkinDonuts,5
2605,Dunkin Donuts wrote this on my order last night,DunkinDonuts,9
2606,Starbucks vs Dunkin Donuts,DunkinDonuts,4
2607,Brown Sugar Cookie Rant,DunkinDonuts,4
2608,New swirls soon????,DunkinDonuts,3
2609,Is the Brown Sugar Discontinued?,DunkinDonuts,5
2610,My Dunkins Manager Just Texted This To the GChat,DunkinDonuts,9
2611,Brown sugar cookie,DunkinDonuts,3
2612,I hate that they discontinued hazelnut swirl.. (Rant),DunkinDonuts,8
2613,Anyone else have these?,DunkinDonuts,4
2614,What’s the difference between Cocoa Mocha and Regular Mocha?,DunkinDonuts,10
2615,Anyone why our corn muffins keep coming out like this?,DunkinDonuts,10
2616,Brown Sugar swirl in,DunkinDonuts,4
2617,Agua Fresca?,DunkinDonuts,2
2618,what's with seasonal flavors barely lasting a season?,DunkinDonuts,9
2619,What is the Dunkin’ iced tea made from? Can I buy the brand?,DunkinDonuts,13
2620,Dunkin does not do peanut donuts a service,DunkinDonuts,8
2621,So... hazelnut swirl?,DunkinDonuts,3
2622,Scanning DD perks,DunkinDonuts,3
2623,We are getting Irish creme !,DunkinDonuts,5
2624,Cold brew in a hot cup?,DunkinDonuts,6
2625,Why breakfast so inhuman ?,DunkinDonuts,4
2626,This better not be real 😔😔,DunkinDonuts,5
2627,dunkin almond milk,DunkinDonuts,3
2628,is dunkin almond milk unsweetened?,DunkinDonuts,5
2629,Is there no Red Velvet Swirl this year?,DunkinDonuts,8
2630,Tell me HOW a franchise owner of a new Dunkin Donuts AND a BaskinRobbins location make the employees work both sides for $8 FUCKING DOLLARS AN HOUR??????????,DunkinDonuts,27
2631,Tell me HOW an franchise owner of a Dunkin Donuts AND a BaskinRobbins can make the employees work both sides for $8 FUCKING DOLLARS AN HOUR??????????,DunkinDonuts,26
2632,What’s the difference between cocoa mocha and regular mocha?,DunkinDonuts,10
2633,Customer Service Question,DunkinDonuts,3
2634,At an interview with dunkin,DunkinDonuts,5
2635,What customization do you recommend for dunkin donuts free coffee?,DunkinDonuts,10
2636,"Please help, I need my dunkies",DunkinDonuts,6
2637,Snow and slush outside but I still order the coconut refresher,DunkinDonuts,11
2638,Are the cronuts ever coming back,DunkinDonuts,6
2639,Dunkin coffee order alternative less sugar? Used to get the large with 6 caramel,DunkinDonuts,14
2640,Free medium coffee Wednesday??,DunkinDonuts,4
2641,NO VANILLA ICING ON BROWNIE BATTER DONUT THIS YEAR?!?!,DunkinDonuts,9
2642,100%,DunkinDonuts,1
2643,I still haven't got my W2s,DunkinDonuts,7
2644,Any drink recommendations?,DunkinDonuts,3
2645,Where are the brownie batter filled donuts??,DunkinDonuts,7
2646,Hazelnut flavor swirl?,DunkinDonuts,3
2647,Syrups similar to brown sugar?,DunkinDonuts,5
2648,Can I wear my hat backwards?,DunkinDonuts,6
2649,caramel shortage for anyone else? employee in central fl.,DunkinDonuts,9
2650,Why are employees being silenced?,DunkinDonuts,5
2651,App double ordering?,DunkinDonuts,3
2652,Do you get free coffee while you work?,DunkinDonuts,8
2653,Omg soo good! Calories who ? 🤣,DunkinDonuts,5
2654,I know this was a limited time but do y’all still have those egg/omelette bites?,DunkinDonuts,17
2655,Medium French Vanilla Ice Coffee a Lil Too Sweet,DunkinDonuts,9
2656,What happened to brown sugar?,DunkinDonuts,5
2657,You guys I need to know,DunkinDonuts,6
2658,My hash browns came out free this morning — is there some promo I didn’t know about or did I just get super lucky?,DunkinDonuts,24
2659,Scanning App at Window,DunkinDonuts,4
2660,My bakers choice donuts 🍄,DunkinDonuts,4
2661,How do I remember the drinks?,DunkinDonuts,6
2662,Dunkin Donuts Austria 🇦🇹,DunkinDonuts,3
2663,Leaky lids,DunkinDonuts,2
2664,Y'all sold me expired coke,DunkinDonuts,6
2665,Removal of Egg White Veggie Omelette &amp; Multigrain Thin?,DunkinDonuts,9
2666,How is being a cashier here?,DunkinDonuts,6
2667,gen rant?,DunkinDonuts,2
2668,Does Dunkin Donuts drug test?,DunkinDonuts,5
2669,Possibly a chance for forever free Dunkin’???,DunkinDonuts,7
2671,🪦Here lies jelly donut,DunkinDonuts,4
2672,On shift rn during the blizzard in Boston lol 😆 where I’m at recorded 16 inches rn,DunkinDonuts,17
2673,Spring 2022 (RIP Hazelnut Swirl... it's happening),DunkinDonuts,8
2674,Ok but this combo?? 👌🏽,DunkinDonuts,4
2675,Rolling the dice on Dunkin coffee,DunkinDonuts,6
2676,Mobile DT orders,DunkinDonuts,3
2677,Northerners,DunkinDonuts,1
2678,Dunkin app removed virtual assistant??,DunkinDonuts,5
2679,Tips,DunkinDonuts,1
2680,Next flavors?,DunkinDonuts,2
2681,Dunkin survey coupons,DunkinDonuts,3
2682,Dunkin’ donut coupon for doing a survey,DunkinDonuts,7
2683,Free donut coupon,DunkinDonuts,3
2684,Pink Velvet Latte returning?,DunkinDonuts,4
2685,Out of brown sugar syrup for the season?,DunkinDonuts,8
2686,When did Donut holes get so expensive?,DunkinDonuts,7
2687,How Much Froth in Original Latte?,DunkinDonuts,6
2688,Valentines Donuts?,DunkinDonuts,2
2689,Sugar free ice coffee ideas?,DunkinDonuts,5
2690,"Does anyone remember the cookie dough donuts from several years ago? They were released one time and never brought back again. Please, please bring these delicious pieces of heaven back. They don’t deserve this shade.",DunkinDonuts,36
2691,Lattes,DunkinDonuts,1
2692,Favorite drink?,DunkinDonuts,2
2693,Valentine's day drink ideas?,DunkinDonuts,5
2694,Anyone seen this before on a dunkin order??,DunkinDonuts,8
2695,Help making iced coffee w/ mocha swirl at home?,DunkinDonuts,9
2696,You have got to be kidding me,DunkinDonuts,7
2697,Does anyone know of any new permanent donuts for 2022?,DunkinDonuts,10
2698,Brown Sugar Cookie Discontinued?,DunkinDonuts,4
2699,Girl Scout Flavors?,DunkinDonuts,3
2700,/r/antiwork ----&gt; work,DunkinDonuts,4
2701,Promo code for free beverage!!,DunkinDonuts,5
2702,FREE COFFEE PROMO CODE!!!,DunkinDonuts,4
2703,Brown sugar cookie flavor discontinued as of today,DunkinDonuts,8
2704,"Look at the lids they started using again in Portage, Indiana.",DunkinDonuts,11
2705,shit i gotta deal with at dunkin,DunkinDonuts,7
2706,"Cannot replicate the French vanilla iced coffee, no matter how many variation…..",DunkinDonuts,12
2707,New Mango Pineapple refresher,DunkinDonuts,4
2708,Cheddar Bagel Twist,DunkinDonuts,3
2709,Brown Sugar Discontinued?,DunkinDonuts,3
2710,Donut hearts! ❤️❤️❤️,DunkinDonuts,2
2711,Tasteless blueberry swirl?,DunkinDonuts,3
2712,Smoked vanilla,DunkinDonuts,2
2713,Anyone headed to Dunkin tonight?,DunkinDonuts,5
2714,my only 2022 wishes,DunkinDonuts,4
2715,T-Mobile Tuesday $2 Off Coupon **expires at midnight tonight**,DunkinDonuts,10
2716,I bought the Mocha syrup for at home coffees! Can I get a step by step how to make at home?,DunkinDonuts,21
2717,Hopes for 2022,DunkinDonuts,3
2718,Omelette Bites,DunkinDonuts,2
2719,Is it wrong for me to request off for valentines day?,DunkinDonuts,11
2720,Is there a universal Dunkin rule that requires all employees to make sure the sandwiches have cold cheese and the bagels have enough cream cheese to feed 16 people? Starbucks would never.,DunkinDonuts,32
2721,Found cleaning an old spare donut case *2010*,DunkinDonuts,8
2722,When's the last time yall saw these?,DunkinDonuts,8
2723,When's the last time yall saw these?,DunkinDonuts,8
2724,is it ok for a manager to store customers raw fish straight from the bay in the big freezer for them,DunkinDonuts,21
2725,What do you wanna know?,DunkinDonuts,5
2726,Employees,DunkinDonuts,1
2727,"How many calories in A 10 Oz Hot coffee, with almond milk and a raspberry shot.",DunkinDonuts,16
2728,What time do stores get fresh donuts out?,DunkinDonuts,8
2729,51 cents to Dunkin left on this. Expires tomorrow.,DunkinDonuts,9
2730,What brand of Chicken Salad did they use for the Chicken Salad croissant?,DunkinDonuts,13
2731,Is just working window normal or not?,DunkinDonuts,7
2732,"I’m high, I wanted donuts, I hate when you order “an assortment” and what you get is 75 plain donuts!!!",DunkinDonuts,21
2733,Strawberry Refresher with 2 Boston crème donuts. Yummy,DunkinDonuts,8
2734,Behind the counter at a dunkin in Illinois.,DunkinDonuts,8
2735,Reuse plastic container,DunkinDonuts,3
2736,Does the hazelnut coffee that’s artificially flavored actually have any nuts in it?,DunkinDonuts,14
2737,Senior discount question,DunkinDonuts,3
2738,Caramel macchiato or caramel signature latte?,DunkinDonuts,6
2739,BEST MATCHA DRINK EVER!!!,DunkinDonuts,4
2740,How much do you get paid at your Dunkin? (Not including tips),DunkinDonuts,12
2741,Frozen coffee with whipped cream,DunkinDonuts,5
2742,"When cold cup designs change are old cups tossed, recycled, or it varies?",DunkinDonuts,13
2743,DD Perks Physical Card,DunkinDonuts,4
2744,Stupid question,DunkinDonuts,2
2745,Why do some Dunkin’ locations have wildly different brews from other (water coffee vs really good coffee),DunkinDonuts,17
2746,"I earned my free drink so I want to try one of the more expensive coffees lol. Should I get a latte, cappuccino, or macchiato? I like my coffee sweet! I usually do iced coffee with mocha and blueberry (I know it’s sounds gross but I love it!)",DunkinDonuts,49
2747,iced coffee,DunkinDonuts,2
2748,Does Dunkin have sugar free syrups?,DunkinDonuts,6
2749,Question for employees,DunkinDonuts,3
2750,Boston just updated their city flag.,DunkinDonuts,6
2751,Peaches n’Cream,DunkinDonuts,3
2752,New bagels?,DunkinDonuts,2
2753,Let's unionize,DunkinDonuts,3
2754,Wednesday Free Promo?,DunkinDonuts,3
2755,Didn’t even TRY to make them like the advertisement…but the plain ones are.,DunkinDonuts,15
2756,Interesting customer,DunkinDonuts,2
2757,Coffee drink that doesn’t taste like coffee?,DunkinDonuts,8
2758,Amazing at a guy Karen customer here in Vegas,DunkinDonuts,9
2759,Did DUNKIN get new oat milk?,DunkinDonuts,6
2760,"Really hated the holiday blend, is the winter blend any better?",DunkinDonuts,11
2761,Why did DD get rid of ham? Was it that much more expensive?,DunkinDonuts,13
2762,My old order is boring what can I get instead?,DunkinDonuts,10
2763,Have multiple free drink perks but no one to share with,DunkinDonuts,11
2764,Free T-Mobile Tuesday Dunkin Card,DunkinDonuts,6
2765,Is it usual for employer to make you buy work uniform,DunkinDonuts,11
2766,Anyone have a $2 DD T-Mobile QR code they don’t need?,DunkinDonuts,13
2767,supply chain,DunkinDonuts,2
2768,Mini rant plus pro tip?,DunkinDonuts,5
2769,Anyone else having issues with the Dunkin App?,DunkinDonuts,8
2770,low cal drinks that dont taste like watered down coffee,DunkinDonuts,10
2771,Will there be any new flavors for 2022?,DunkinDonuts,8
2772,childish corporate bakers😂😂,DunkinDonuts,3
2773,Another snow day means another snowman!,DunkinDonuts,6
2774,Y’all were not kidding about the brown sugar cookie latte. It’s SO good!,DunkinDonuts,15
2775,Dunkin Donuts petty complaints (from me),DunkinDonuts,6
2776,Healthiest best tasting cold drink ? I wanna see what my fellow Dunkinees get hehe:),DunkinDonuts,14
2777,Found these items today lol,DunkinDonuts,5
2778,Is this drink supposed to come with whipped cream?,DunkinDonuts,9
2779,First time trying✨Became my favorite coffee drink!,DunkinDonuts,8
2780,Trying Everything From Dunkin Donuts,DunkinDonuts,5
2781,Iced mocha latte,DunkinDonuts,3
2782,Is Dunkin being slimy? Covid,DunkinDonuts,5
2783,"Update: As y’all can see, the bakers are baking 2day 😁😂",DunkinDonuts,11
2784,Refund refused,DunkinDonuts,2
2785,Iced winter blend coffee with brown sugar cookie swirl... couldn't taste it?,DunkinDonuts,13
2786,Are macchiatos annoying to make?,DunkinDonuts,5
2787,"**Question for employees** This is the 2nd day in a row that I've asked for mocha and hazelnut, but received mocha and vanilla. I was just wondering if these 2 things sound the same through the speaker? Just weird that it happened 2 days in a row lol",DunkinDonuts,49
2788,"We figured out dual drink trays works best for roxxie from dunkin's, she will hold off on complaining for for now",DunkinDonuts,22
2789,Bad news…,DunkinDonuts,2
2790,this is the best Dunkin ever!,DunkinDonuts,6
2791,This is a funny video,DunkinDonuts,5
2792,This is funny,DunkinDonuts,3
2793,This is funny,DunkinDonuts,3
2794,Hazelnut Swirl,DunkinDonuts,2
2795,My Dunkin keeps giving me iced coffee when I ordered a latte…,DunkinDonuts,12
2796,Question About Getting Hired at Dunkin,DunkinDonuts,6
2797,How many pieces of bacon are in the snackin bacon? My local Dunkin’ says there’s a bacon shortage and charges $3 for 3 pieces!!!!,DunkinDonuts,25
2798,Cappuccino is watery,DunkinDonuts,3
2799,I can’t believe that someone actually did this today 🤦‍♂️,DunkinDonuts,10
2800,Is it possible to buy the syrup?,DunkinDonuts,7
2801,Shot flavoring ingredient - aspartame?,DunkinDonuts,4
2802,Why is there no consistency? A small rant,DunkinDonuts,8
2803,DD is no longer a more affordable option for your daily dose of coffee.,DunkinDonuts,14
2804,"$6.18 for two egg and cheese wraps, miss the Go2s",DunkinDonuts,11
2805,Confused about the hiring process,DunkinDonuts,5
2806,Should have checked it before I got to work…,DunkinDonuts,9
2807,Roxxie is very unhappy with the size of the drink trays at dunkin's and wants to lodge a complaint,DunkinDonuts,20
2808,Complaint,DunkinDonuts,1
2809,CDC guidelines,DunkinDonuts,2
2810,Did the almond milk prices go up again?,DunkinDonuts,8
2811,Rampant closing early,DunkinDonuts,3
2812,Rampant closing early,DunkinDonuts,3
2813,Did I need to order more swirls?,DunkinDonuts,7
2814,So Dunkin violates the Disabilities Act,DunkinDonuts,6
2815,Really proud of this one.,DunkinDonuts,5
2816,Sooo does anyone know how to turn off a gen 1 turbo chef oven?,DunkinDonuts,14
2817,@Other Employees,DunkinDonuts,2
2818,"Issues with the app when ordering 1 cream, 1 swirl, etc",DunkinDonuts,11
2819,"Is pink velvet swirl coming back this year? I live under a rock, sorry.",DunkinDonuts,14
2820,Baking Donuts,DunkinDonuts,2
2821,yummy turkey sausage,DunkinDonuts,3
2822,"Brother exposed, should i stay home from work?",DunkinDonuts,8
2823,Wait your turn,DunkinDonuts,3
2824,Winter Blend calories?,DunkinDonuts,3
2825,The nakedness..,DunkinDonuts,2
2826,"Good news everyone! They caught him, justice shall be served!",DunkinDonuts,10
2827,Starting as a GM next week. Any rookie mistakes to avoid?,DunkinDonuts,11
2828,Peanut donuts,DunkinDonuts,2
2829,Delivery Truck,DunkinDonuts,2
2830,How come they won’t butter my muffin anymore?,DunkinDonuts,9
2831,"Thought this Sign was Hilarious, but then it happened to Me",DunkinDonuts,11
2832,Bavarian Cream Munchkins Who Remembers? I just found out they stopped making them?!? I grew up loving these the most! If none of you know about this I swear I’m in the Mandela effect or something.,DunkinDonuts,37
2833,Question is vanilla spice vanilla chai? Just wondering,DunkinDonuts,8
2834,Heard you were looking for me,DunkinDonuts,6
2835,Lids on X-Large Coffees,DunkinDonuts,5
2836,Two glazed donut shades we got this morning....,DunkinDonuts,8
2837,Refreshers,DunkinDonuts,1
2838,You rang?,DunkinDonuts,2
2839,i been really liking this combo with the winter blend,DunkinDonuts,10
2840,I’ve never ordered through the online app but can I use many cards for payment? I have a virtual visa gift card (not DD card) and also would like to use my own card for the remaining amount.,DunkinDonuts,39
2841,Strawberry Dragonfruit,DunkinDonuts,2
2842,Should Dunkin’ Donuts have milkshake on their menu,DunkinDonuts,8
2843,Mocha Swirl At Home,DunkinDonuts,4
2844,How does the sugar work compared to flavor swirls?,DunkinDonuts,9
2845,Workers of Dunkin.. what are your typical shifts?,DunkinDonuts,8
2846,Bring back the veggie egg white!,DunkinDonuts,6
2847,Do the unsweetened flavors have a weird chemically after taste?,DunkinDonuts,10
2848,Omelette bites,DunkinDonuts,2
2849,A Crappy Experience,DunkinDonuts,3
2850,Is there anything with caffeine thats not coffee?,DunkinDonuts,8
2851,"HuffPost reported that Dunkin’ Donuts and pastries all come frozen, is this true?",DunkinDonuts,13
2852,I Will Give Up My Left Kidney for a Jug of Peanut Butter Swirl. Anyone Have a Connection? 👀,DunkinDonuts,18
2853,Please stop filling ice coffees with so much ice,DunkinDonuts,9
2854,I miss the heath flavor. what's the closest thing I can get??,DunkinDonuts,13
2855,am i an asshole?,DunkinDonuts,4
2856,Quit my job,DunkinDonuts,3
2857,"My new creation, veggie omelette bites on a English muffin, melted half slice cheese on each and ketchup",DunkinDonuts,18
2858,Are the Go2s done?,DunkinDonuts,4
2859,Chai?,DunkinDonuts,1
2860,"For those who have the $2 any size happy hour promo in their area, does it work when you order through the app? The offer never applies on there for me, even though it appears under the offer tab.",DunkinDonuts,39
2861,"For those who have the $2 any size happy hour promo in their area, does it work when you order through the app? The offer never applies on there for me, even though it appears under the offer tab.",DunkinDonuts,39
2862,"How many grams is one sugar? One large iced latte with sugar has 35 grams of added sugar, seems excessive for 4 sugars (default on the app).",DunkinDonuts,27
2863,Hired as a closing shift manager,DunkinDonuts,6
2864,PINK VELVET MACCHIATO AT HOME???,DunkinDonuts,5
2865,a message from a college student:,DunkinDonuts,6
2866,should i go back?,DunkinDonuts,4
2867,I shit myself,DunkinDonuts,3
2868,When are they suppose to?,DunkinDonuts,5
2869,Easiest way to ask for this drink?,DunkinDonuts,7
2870,Is there a shortage of decaf coffee?,DunkinDonuts,7
2871,Dunkin 2 for 2$ are gone from my app :(,DunkinDonuts,9
2872,local dunkin prices look like starbucks 😬,DunkinDonuts,6
2873,Omelette Bites are a massive rip off,DunkinDonuts,7
2874,Egg bites,DunkinDonuts,2
2875,Is it true they replaced the red velvet this year for valentines day with raspberry?,DunkinDonuts,15
2876,"2 years ago today, playin some munchkin golf",DunkinDonuts,8
2877,Winter blend brown sugar cookie iced coffee!,DunkinDonuts,7
2878,new things you can skip on,DunkinDonuts,6
2879,Is there any way to mimic the Toasted White Chocolate latte?,DunkinDonuts,11
2880,$2 Winter Blend - Not All Stores?,DunkinDonuts,6
2881,Ham,DunkinDonuts,1
2882,"Anybody like Dunkin's new Omlet Bites. I think their not bad, but not worth the price.",DunkinDonuts,17
2883,How can I make a Pumpkin Spice hot coffee at home?,DunkinDonuts,11
2884,Who’s ready to risk their lives to serve people coffee tomorrow?!,DunkinDonuts,12
2885,Verbally Abusive Managers?,DunkinDonuts,3
2886,"Well….this happened today #winterweatheradvisory now a #winterstormwarning in Hendersonville, Tn maybe 2 inches! Corporate gave us the(managers) the go ahead to close at 12n and so we did!",DunkinDonuts,30
2887,That caramel and blueberry hit different!🔥,DunkinDonuts,6
2888,brown sugar cookie cold brew not on app,DunkinDonuts,8
2889,I recommend trying these bad boys out,DunkinDonuts,7
2890,Policy Question,DunkinDonuts,2
2891,Policy Question,DunkinDonuts,2
2892,Policy Question,DunkinDonuts,2
2893,My GM employed her boyfriend and Im curious as to what the policy is at DD.,DunkinDonuts,16
2894,Brown sugar iced latte,DunkinDonuts,4
2895,Someone help! Is the Oreo hot chocolate discontinued at Dunkin donuts?,DunkinDonuts,11
2896,I'm not sure why.... But I think I just found coffee heaven,DunkinDonuts,13
2897,Allergic reaction to dunkin new syrup,DunkinDonuts,6
2898,Snacking bacon,DunkinDonuts,2
2899,Winter Blend Taste Test!,DunkinDonuts,4
2900,Brown sugar cookie,DunkinDonuts,3
2901,Ingredients for the omlette bites egg bacon and cheddar,DunkinDonuts,9
2902,Ingredients for the omlette bites egg bacon and cheddar,DunkinDonuts,9
2903,What other flavor pairs well with caramel for iced drinks?,DunkinDonuts,10
2904,Was going through my camera roll and found this old classic,DunkinDonuts,11
2905,Brown Sugar Swirl Mixing Ideas,DunkinDonuts,5
2906,The Winter coffee with the brown sugar swirl is the best thing Dunkin has,DunkinDonuts,14
2907,"Snickers iced coffee with xxxtra cold foam, caramel drizzle and mocha drizzle and some cinnamon sugar",DunkinDonuts,16
2908,"Orange Creamsicle Coolatta 💛🍊Half a (11.5oz) bottle of orange juice blended with 3 pumps vanilla bean and 3 creams. Pour the rest of the orange juice in your cup, add the blended coolatta and top with whipped cream. DELICIOUS. Has anyone else made this?",DunkinDonuts,45
2909,Do you think Dunkin Donuts coffee has contributed to sever weight gain?,DunkinDonuts,12
2910,This has to be a joke🤣,DunkinDonuts,6
2911,Dunkin customer,DunkinDonuts,2
2912,"Got asked my number by an employee, panicked and didn’t give it, now I can’t stop thinking about it",DunkinDonuts,21
2913,"I have a question for dunkin employees, I’ve always wondered; how are the donuts made??",DunkinDonuts,16
2914,Question about iced coffee,DunkinDonuts,4
2915,Sick time,DunkinDonuts,2
2916,Brown sugar frozen coffee!,DunkinDonuts,4
2917,Help with making a Dunkin Caramel Cold Brew at home,DunkinDonuts,10
2918,Black ice coffee with avocado toast,DunkinDonuts,6
2919,Pink velvets return?,DunkinDonuts,3
2920,Out of order bathroom,DunkinDonuts,4
2921,Time to make the donuts!,DunkinDonuts,5
2922,Why do you get mad at me for discounts that don’t exist,DunkinDonuts,13
2923,Start working at dunkin on the 8th. Any tips,DunkinDonuts,9
2924,Finally quit my job,DunkinDonuts,4
2925,Is happy hour gone,DunkinDonuts,4
2926,What's coming Winter 2022,DunkinDonuts,5
2927,thoughts on the new stroopwafel donut?,DunkinDonuts,6
2928,How would you go about asking for a milk-free Iced Mocha?,DunkinDonuts,12
2929,"I join the ranks today of ""why would you order this""",DunkinDonuts,11
2930,"I join the ranks today of ""why would you order this""",DunkinDonuts,11
2931,Items No Longer on The Menu For 2022?,DunkinDonuts,8
2932,Coffee Sizes,DunkinDonuts,2
2933,Drink recommendations,DunkinDonuts,2
2934,my dunkin had a gas leak and evacuation during my shift,DunkinDonuts,11
2935,I was talking to someone who works at dunkin’ donuts and i realized that all of your weird dunkin orders belong on r/greaseposting,DunkinDonuts,24
2936,curiosity,DunkinDonuts,1
2937,i made a subreddit for all of your crazy dunkin orders because there are never too many,DunkinDonuts,17
2938,Dating Rules,DunkinDonuts,2
2939,This was at the bottom of my latte…. Ideas on what it is?,DunkinDonuts,13
2940,how long should it take to call me back?,DunkinDonuts,9
2941,how long should it take for a call back?,DunkinDonuts,9
2942,fyi customers…,DunkinDonuts,2
2943,Just why,DunkinDonuts,2
2944,When is peppermint mocha getting taken off the menu?,DunkinDonuts,9
2945,Dunkin giving out close to empty drinks.,DunkinDonuts,7
2946,I really want a hot black coffee and a butternut donut right now 😈😈😈,DunkinDonuts,13
2947,I really want a hot black coffee and a butternut donut right now 😈😈😈,DunkinDonuts,13
2948,doordash/uber eats orders are never a pleasure to make,DunkinDonuts,10
2949,Does dunkin have a corporate office so I can report this?,DunkinDonuts,11
2950,I'm stupid,DunkinDonuts,3
2951,"Dunkin' and Baskin-Robbins to Open in Four Corners (Silver Spring, MD)",DunkinDonuts,12
2952,No happy medium(roast) :(,DunkinDonuts,4
2953,Quite possibly the most disgusting hot coffee I’ve made for a doordash customer…,DunkinDonuts,14
2954,New winter menu,DunkinDonuts,3
2955,my bf got this absolute monstrosity of a drink and when he picked it up all my coworkers came to the dt window to make fun of him 🤪🤪,DunkinDonuts,28
2956,"Everything latte, anyone?",DunkinDonuts,3
2957,Need to wake up!,DunkinDonuts,4
2958,New January menu,DunkinDonuts,3
2959,Tim Hortons is the poor mans DUNKIES,DunkinDonuts,7
2960,Small iced coffee with just a splash of coffee,DunkinDonuts,9
2961,Why do their bagels never come out toasted? It's always just soft and warm bread.,DunkinDonuts,16
2962,Trying the new omelet bites today 😋,DunkinDonuts,6
2963,Maple Sugar Snackin Bacon,DunkinDonuts,4
2964,"The most flavor that made me stop after the first drop, too much flavor",DunkinDonuts,14
2965,Dunkin putting in a whipped cream cap in my drink and leaving it in there. I didn’t even realize till I got to the bottom of my drink due to the cap being filled with my iced coffee #should’vesued,DunkinDonuts,41
2966,"🎄🎄My favorite dunk low medium curry fossil, birthday gift from my wife. Legit check!",DunkinDonuts,14
2967,Have a 22$ Dunkin account. Anyone interested in buying at 11$ of crypto?,DunkinDonuts,13
2968,"👀 recently got in the delivery, not sure when we will start selling it",DunkinDonuts,13
2969,Question for Delivery a Orderers,DunkinDonuts,5
2970,"Well….This happened between 7p-5a! He didn’t even bother to cover his face, how stupid can he be!? Yes we’re even open for business tonight smart I think not cuz I sure as hell wouldn’t be working tonight!",DunkinDonuts,42
2971,Got a question for customers,DunkinDonuts,5
2972,Is there some new third flavor of stuffed bagel minis??,DunkinDonuts,10
2973,The doughnuts at Dunkin Stuttgart are amazing ♥️🍩,DunkinDonuts,7
2974,Gripping A Dream Donut,DunkinDonuts,4
2975,What is your favorite sandwich and drink?,DunkinDonuts,7
2976,"Is this the right Sourdough Breakfast Sandwich? The shape of the bread and the inside doesn’t seem to match.. I might be remembering it wrong, but I don’t think the one I got last time was in this shape (not the bread, the inside)",DunkinDonuts,46
2977,"What does ""sand expo prt"" mean on the sticker on the bag?",DunkinDonuts,12
2978,Local store no longer selling gift cards. Wtf??,DunkinDonuts,8
2979,Chai Latte...Strange Taste,DunkinDonuts,4
2980,Being able to put the paper towel down at night &gt;&gt;,DunkinDonuts,12
