,title,subreddit,words_in_sentence
2356,Heavy cream shortage.,starbucks,3
2357,Am I ordering my drink wrong?,starbucks,6
2358,I found this in my freezer at home. I do not remember putting it there.,starbucks,15
2359,"First Coverage Shift And I Feel Unprepared, Any Advice?",starbucks,9
2360,I feel dead,starbucks,3
2361,No more Almond Crossiants?! 😭,starbucks,4
2362,Need sanity check on new store policies,starbucks,7
2363,"Can I have one Birthday Cale Pop, with extra birthday?",starbucks,10
2364,care at work,starbucks,3
2365,Who does what at Starbucks?,starbucks,5
2366,Customer got annoyed that we can’t give him the currency he wants.,starbucks,13
2367,Current Barista Car living,starbucks,4
2368,"""Grande Americano with Steamed Half and Half""",starbucks,7
2369,"""Grande Americano with steamed half and half""",starbucks,7
2370,Horrible experience with the food,starbucks,5
2371,Drink Inspo?,starbucks,2
2372,my first flat white!!,starbucks,4
2374,Sedgwick LOA,starbucks,2
2375,How long did it take for your parter number to generate?,starbucks,11
2376,We got chicken maple sandwiches instead of the impossible we were supposed to get. Any insight on if we can sell them now? I couldn't find anything on the hub.,starbucks,31
2377,What’s your favorite non-caffeinated drink?,starbucks,7
2378,This is such a dumb question,starbucks,6
2379,Starbucks Latte Ratios,starbucks,3
2380,loa and still working?,starbucks,4
2381,Question about the ASU benifits,starbucks,5
2382,"I miss you, ham and Swiss croissant",starbucks,7
2383,how to order,starbucks,3
2384,are partner discounts supposed to be automatic?,starbucks,7
2385,"Coffee Frappuccino with Flavor, what is the whipped cream standard?",starbucks,10
2386,What is the policy for remaking drinks with No proof of purchase?,starbucks,12
2387,advice/help (venti rant too),starbucks,5
2388,How to politely ask customers to move out of the way at the handoff.,starbucks,14
2389,All I could think while making this was “what is this? whose mother posted this recipe on fb?”,starbucks,18
2390,late but favorite lgbt+ board,starbucks,5
2391,Cursed cake pop,starbucks,3
2392,smoking,starbucks,1
2393,Someone comes in with a passport the other day,starbucks,9
2394,Asked to cover shift without mentioning possible COVID exposure?,starbucks,9
2395,paystub emails?,starbucks,2
2396,fall launch sign ft. duolingo cake pop,starbucks,7
2397,Rejected?,starbucks,1
2398,Iced pumpkin spice latte,starbucks,4
2399,is it unwise to eat week old pastries i forgot i took home 🤔,starbucks,13
2400,the way she yelled at me when i told her i have to charge her for 2 drinks...,starbucks,18
2401,Brand new partner! Anything I should be extra cautious/aware of?,starbucks,11
2402,New to Starbucks,starbucks,3
2403,Scammers?,starbucks,1
2404,Am I in the Wrong? Embarrassed in Front of Team...,starbucks,10
2405,Owl cake pop be goin through it 😂,starbucks,7
2406,yummy and delicious 20 day expired butter croissant 😍,starbucks,8
2407,new hire - wanting to switch stores.,starbucks,6
2408,Is it normal to get scheduled four 8hr shifts back to back ?,starbucks,12
2409,What is wrong with my store,starbucks,6
2410,"$7k by 1:30 pm (with mobiles off), cars wrapped around the store all morning, and line out the door. Then we get this.",starbucks,24
2411,Pro tip when making cold brew🤩,starbucks,6
2412,Am I crazy for wanting more bar time,starbucks,8
2413,(Venti) Got offered a corporate location job a month after working at licensed,starbucks,13
2414,I have no idea what I’m doing,starbucks,8
2415,what is this drink? got it at B&amp;N cafe,starbucks,11
2416,Question,starbucks,1
2417,Working with Covid?,starbucks,3
2418,right after doing the floors too..,starbucks,6
2419,Not an employee anymore (216****) but I came across this and I wanted to have a picture of my fav name tag for memories! ❤️,starbucks,24
2420,people didnt know the plates under the refreshers came up and found this on my first clean play. almost died.,starbucks,20
2421,Fired for calling in sick?,starbucks,5
2422,"Baristas of Starbucks, genuine question..",starbucks,5
2423,Why custom tea so difficult?,starbucks,5
2424,This is what the apple macchiato tastes like,starbucks,8
2425,"My breakfast on break today. Everything bagel extra toasted, avocado spread, soft boiled egg from home. This hit.",starbucks,18
2426,How does Starbucks handle s*xual harassment? TW,starbucks,8
2427,Starbucks Union Swag,starbucks,3
2428,Wtf,starbucks,1
2429,227xxxx jumping back in.,starbucks,4
2430,So we got a new shift (and yes he did drink it),starbucks,12
2431,Future Roast account was liquidated,starbucks,5
2432,Am I the only person who dislikes the apple crisp oat milk macchiato,starbucks,13
2433,imagine the smeel,starbucks,3
2434,Anyone else out of Vanilla syrup?,starbucks,6
2435,"I go to Starbucks a couple of times a week, and I usually get a drink, spend a couple of hours at the store, literally wasting time, and browsing the interweb and listening to music on an iPad, and the state so many customers leave their tables it’s absolutely ridiculous… F ing entitled people…",starbucks,55
2436,"At $4, this is probably the cheapest apple latte you can get",starbucks,12
2437,I swear last year's Fall launch didn't hit THIS hard.,starbucks,12
2438,What are you making if you get this order?,starbucks,9
2439,Repost w/o store number. My store was at $7k before 2pm with mobiles turned off. Lots of these type of orders today.,starbucks,23
2440,Since I’ve heard the PSL isn’t great this year…,starbucks,11
2441,TW: Domestic violence.,starbucks,3
2442,The fact that they didn't name it Czarbucks!? I'm upset,starbucks,12
2443,Make Your Own Lid Tumbler,starbucks,5
2444,One of my shift managers continuously makes me feel like I'm always doing something wrong or not good enough,starbucks,20
2445,Starbucks,starbucks,1
2446,the new cake pops tho.,starbucks,5
2447,Onboarding. Plz help,starbucks,3
2448,i know this may be a silly question…how does your store make their iced coffee? i am new and wanted to make sure i have the right recipe (our coffee comes grounded in the little bags..) thank you!!☺️,starbucks,39
2449,How many tablespoons in a “pump?”,starbucks,6
2450,Question About Tipping,starbucks,3
2451,Ordered black spoons but they sent the tools on the left. Does anyone know what they're for?,starbucks,18
2452,pls tell me it gets better,starbucks,6
2453,Is it normal for the apple crisp oatmilk macchiato to have a ton of apple flavor at the end?,starbucks,19
2454,"Penske’s Revenge: Long story short, our Penske guys hate my store and never deliver our full order especially this week so they blocked our backroom 😐",starbucks,26
2455,Who decides what music plays inside the store?,starbucks,8
2456,The avocado spread,starbucks,3
2457,Tea recommendations with pumpkin spice?,starbucks,5
2458,when you need to leave bar for a poop break do you warn your cover you're gonna be a minute,starbucks,21
2459,partners dating?,starbucks,2
2460,Dairy in syrups?,starbucks,3
2461,Coming to you live from pumpkin spice opening weekend. We’ve hit $7k by 2pm with mobiles off!,starbucks,18
2462,how to become a black apron without knowledge of how to make beverages???????,starbucks,13
2463,question,starbucks,1
2464,What are you thoughts on the new CEO?,starbucks,8
2465,Don’t blame ur barista for ur dumb decision! It’s on u if ur late bc of ur coffee,starbucks,20
2466,Tax Exemption,starbucks,2
2467,my favourite boards i’ve done in my store! :^),starbucks,9
2468,"What should I answer for ""what are your salary expectations?""",starbucks,10
2469,Pumpkin Cold Cream Foam Recipe,starbucks,5
2470,What’s the difference between iced coffee and cold brew?,starbucks,10
2471,ASU Sbux Partners help,starbucks,4
2472,Decaf Mocha Frappuchino,starbucks,3
2473,"I appreciate the cute sticker, but…",starbucks,6
2474,semi-dumb question,starbucks,3
2475,Can I ask for a pumpkin cream cold brew to be shaken,starbucks,12
2476,I quit two weeks ago and I haven’t picked up my tips yet,starbucks,14
2477,Awesome playlist!,starbucks,2
2478,Card Tips,starbucks,2
2479,Show off your favorite pin!!!,starbucks,5
2480,Pumpkin drinks standard?,starbucks,3
2481,Bagels?,starbucks,1
2482,Do you like the next CEO-Laxman Narasimhan,starbucks,8
2483,Starbucks matcha question,starbucks,3
2484,Feedback on experience,starbucks,3
2485,I’ve never ordered anything but a standard latte w a milk variation. Is this type of cold brew customization a pain to make?,starbucks,24
2486,"Raise your hand if you're excited about the new CEO!! Surely this is our chance to get more labor, no more union busting, and a fair livable wage.....right?",starbucks,30
2487,Sticker cube,starbucks,2
2488,tell me if I should feel bad,starbucks,7
2489,Greetings from Finnish Starbucks 🇫🇮,starbucks,4
2490,Tall rant / need some advice,starbucks,5
2491,Nail Polish??,starbucks,2
2492,Does anyone else say the completely wrong thing when handing things out the window,starbucks,14
2493,I’ve heard it. The pronunciation I now hate the most.,starbucks,11
2494,Venti rant (sorry),starbucks,3
2495,Tips on how to close grande dome lids?,starbucks,8
2496,espresso drinks in trenta cups,starbucks,5
2497,cold brew maker recommendations?,starbucks,4
2498,Partner Advice,starbucks,2
2499,I got the job 😄,starbucks,4
2500,Online schedule is confusing? recent hire,starbucks,6
2501,Grande Rant,starbucks,2
2502,Excuse me but this is a Wendy’s! They ordered it 30 minutes before closing but Thankfully I never made it and they never showed up 😭,starbucks,26
2503,"Tips for young, new SM’s",starbucks,6
2504,How to wash aprons without them getting tangled,starbucks,8
2505,Tips for your first day as a Barista,starbucks,8
2506,Baristas...Rate our orders!,starbucks,4
2507,First Game Day,starbucks,3
2508,"Leaving, PTO",starbucks,2
2509,Ima slu t for pink drink but a poor sl ut,starbucks,11
2510,290 over and out,starbucks,4
2511,Christmas season and time off—Question and venti rant.,starbucks,9
2512,Is it worth the return?,starbucks,5
2513,I know it's not a huge deal but...,starbucks,9
2514,you ever like to take orders with funny voices?,starbucks,9
2515,Pay raise in august,starbucks,4
2516,Quiet quiting,starbucks,2
2517,There’s a Starbucks coffee cup in every scene of Fight Club.,starbucks,12
2518,Karen story,starbucks,2
2519,Work next to a high school. Rough two days. Fuck these kids bro.,starbucks,13
2520,I just really like painting name tags,starbucks,7
2521,Cute Jack Skellington Starbucks sticker!,starbucks,5
2522,Amazing Cup,starbucks,2
2523,So I found a roach at my job. Should I be worried?,starbucks,12
2524,262 signing out. Finally.,starbucks,4
2525,Short rant,starbucks,2
2526,So I found a roach at my job. Should I be worried?,starbucks,12
2527,tongue piercings,starbucks,2
2528,Hot and sticky lemon loaf 🤢,starbucks,5
2529,the truth about working at starbucks #tobeapartner #unionizestarbucks,starbucks,8
2530,Decaf Drink Recommendations,starbucks,3
2531,My wife’s first day at a franchise location and she sends me this. 🤮,starbucks,14
2532,i miss the green boxes...these blue boxes just aren't as visually appealing,starbucks,14
2533,Is your store batching Pumpkin foam into cubes/pitchers,starbucks,9
2534,forbidden fruit,starbucks,2
2535,Casi Cielo 2022 available,starbucks,4
2536,All thanks to the power being out at other Starbucks locations,starbucks,11
2537,67th attempt to scare the karens,starbucks,6
2538,Has anyone else gotten an order for a caramel macchiato frappuccino?,starbucks,11
2539,trying to scare the karens,starbucks,5
2540,Made this beauty. Strawberry açaí lemonade with raspberry topped with passion tango,starbucks,12
2541,a question to baristas regarding cold brews w/o ice,starbucks,10
2542,Barista minimum wage in Texas?,starbucks,5
2543,Dome Lids,starbucks,2
2544,Don’t ever ask for WASHROOM at Starbucks!,starbucks,8
2545,White warning symbol in Partner Hour - My Schedule,starbucks,8
2546,Funny sign.,starbucks,2
2547,why would someone get half blonde half dark and not just medium roast?,starbucks,13
2548,Will they ever get these back?,starbucks,6
2549,New green bean here..what do you recommend to someone just starting out?,starbucks,13
2550,Vaccine pay still a thing?,starbucks,5
2551,Any second job recommendations + store transfer process,starbucks,7
2552,is this right??,starbucks,3
2553,Apparently no one has cleaned the sleeve holders at my store in a few years…,starbucks,15
2554,"When is PSL Season, I am freaking hyped!!!",starbucks,8
2555,The customizations are getting OUT OF HAND,starbucks,7
2556,"Do you prefer to get your drink: Warm, Steamed Hot, or Extra Hot?",starbucks,13
2557,Anyone else having trouble putting on dome lids recently?,starbucks,9
2558,I made a thing.. this is how I feel being on bar lately,starbucks,13
2559,latte art,starbucks,2
2560,Chillllll,starbucks,1
2561,Is this normal?,starbucks,3
2562,a better PSL,starbucks,3
2563,Question for the Baristas,starbucks,4
2564,Are we filling up the Brown Sugar Oatmilk Shaken Espressos now?,starbucks,11
2565,part time ASM?,starbucks,3
2566,Ask a Neuroscience Expert: Why Are We So Obsessed with Pumpkin Spice?,starbucks,12
2567,Can I buy a grande of pumpkin cold foam?,starbucks,9
2568,What are the new partner numbers starting with now?,starbucks,9
2569,"I would really like to order a tall pumpkin spice latte, but don’t like things too sweet. Should I try it with only 1 pumps or 2 pumps of the pumpkin syrup (originally 3)?",starbucks,35
2570,New holiday cup,starbucks,3
2571,how would YOU ring this up,starbucks,6
2572,What do you wear? New Employee :(,starbucks,6
2573,Starbucks Cups,starbucks,2
2574,why?,starbucks,1
2575,I worked so hard today. I hate Ted Cruz and his comment so much.,starbucks,14
2576,been working at starbucks just a little more than 6 months and i’ve already started collecting coffee cause i love the flavors! thinking about doing the coffee master program once i fill up my passport!,starbucks,36
2577,Was this a one time thing Starbucks did? I loved these and I can’t find any info on them,starbucks,20
2578,Need some time for myself,starbucks,5
2579,I get the feeling that there are a lot of baristas who decorate their stores on their own dimes and time.,starbucks,21
2580,Lyft pass not working??,starbucks,4
2581,"Just curious,",starbucks,2
2582,New SSV,starbucks,2
2583,menu items,starbucks,2
2584,Feeling out of place,starbucks,4
2585,"As a barista, would these mobile drink orders annoy you? Also, curious your take on mobile orders.",starbucks,17
2586,What should i expect while opening?,starbucks,6
2587,My name is Bella I was the only person in the store lol,starbucks,13
2588,Silliest/memorable mobile order names?,starbucks,5
2589,my go to order is an unsweet green iced tea with a shot of expresso.,starbucks,15
2590,I'm writing off Starbucks for good!,starbucks,7
2591,"Not sure which makes me happier, our raises or this! 😅🤩",starbucks,10
2592,my random starbucks drink thoughts,starbucks,5
2593,The wonderful world of working at Starbucks!,starbucks,7
2594,Can anyone help me with calories for a grand pumpkin spice latter with no whip and oatmilk?,starbucks,17
2595,Curious question about pumpkin cream cold brew!,starbucks,7
2596,Some name tags I made for my coworkers,starbucks,8
2597,"""Mobile Order for..."" *clears throat and walks away.*",starbucks,8
2598,How do I put the shot on the side of my drink without having to pay the extra $2.25 for it?!,starbucks,22
2599,Birthday Strawberry Cheesecake needs substitute for white mocha in off-season,starbucks,11
2600,Washing aprons,starbucks,2
2601,All the SM in my area are all white. out of 9 stores in our area every single one is white no diversity. Especially when you see individuals of a different race apply for these ask positions what do you do.,starbucks,41
2602,Anyone else having issues with Lyft?,starbucks,6
2603,Is this a real interview?,starbucks,5
2604,What are the popular basic white girl orders right now?,starbucks,10
2605,Starbucks at the grocery store in Finland!,starbucks,7
2606,San Clemente | Patrick Parry - Your Local Luxury Realtor,starbucks,8
2607,pay question,starbucks,2
2608,Why is it this bad,starbucks,5
2609,Are there graham crackers I can ask for to recreate this drink?,starbucks,12
2610,Paper check?,starbucks,2
2611,Paper check?,starbucks,2
2612,plant-based substitute for pumpkin cold foam?,starbucks,7
2613,what do i say to my barista to order this?,starbucks,10
2614,Indian-origin Laxman Narasimhan becomes new Starbucks CEO – Everything you need to know,starbucks,13
2615,Indian-origin Laxman Narasimhan becomes new Starbucks CEO – Everything you need to know,starbucks,13
2616,pumpkin cream cold brew,starbucks,4
2617,This never made sense to me.,starbucks,6
2618,apple crisp,starbucks,2
2619,"Pay raise question.. is it true that other states (not CA) are getting $15.50? I live in CA and it’s unbearable living here with rent being so high, but looking to move to another state, if you guys are getting $15.50.",starbucks,44
2620,hired at interview? and waiting…,starbucks,5
2621,transferring as a new ssv,starbucks,5
2622,321xxxxx clocking out,starbucks,3
2623,(RANT) School is clashing with job,starbucks,6
2624,"interviewed, wasn't hired, referred to another store...",starbucks,8
2625,Anything I can do to increase my chances of getting hired?,starbucks,11
2626,I guess he will change the name of “Chai Tea Latte” to “Tea Tea Latte”.,starbucks,15
2627,Starbucks app doesn't let me order in advance,starbucks,9
2628,Cheaper Spin on Pumpkin Cream Cold Brew,starbucks,7
2629,January ‘23 raise? Yes? No?,starbucks,5
2630,Decorated for fall. 🍂,starbucks,3
2631,Which is better regular starbuck or target Starbucks,starbucks,8
2632,How come you can’t order water in the app?,starbucks,10
2633,Weird POS bug??,starbucks,3
2634,New CEO. Is this bad or good news for the unions?,starbucks,11
2635,We are fall-ing for you.,starbucks,6
2636,Lyft to Work?,starbucks,3
2637,upside down brown sugar oatmilk shaken espresso,starbucks,7
2638,App doesn't stop loading?,starbucks,5
2639,Empathize with me,starbucks,3
2640,"cant never go to starbucks with no one. They always gotta have their kid(s) around which is fine but now??? Never again, never again. 😐",starbucks,25
2641,Lyft Pass question,starbucks,3
2642,Lyft app not working ! Is this nation wide ? Our store in Houston is experiencing issues using the app as the promo isn’t coming up anymore !,starbucks,26
2643,What happened to the birthday cake pops? First time getting them in a long time and they were crusty and dark pink. I remember them being smooth &amp; light pink. Manager told me they’re fine but idk?,starbucks,38
2644,Rate my drink,starbucks,3
2645,partner discounts,starbucks,2
2646,Barista with a college degree are you still pursuing your dream job? What’s degree?,starbucks,15
2647,Starbucks Names Laxman Narasimhan as Next Chief Executive Officer,starbucks,9
2648,New SS tips?,starbucks,3
2649,dark caramel sauce,starbucks,3
2650,Making drinks in reusable cups?,starbucks,5
2651,Can’t make this up 🤢,starbucks,5
2652,EMPLOYEES! what do you eat during your shift?,starbucks,8
2653,whats up with store managers?,starbucks,5
2654,Any baristas who are into anime?,starbucks,6
2655,I was on bar 2 today,starbucks,6
2656,i thought this was pretty funny,starbucks,6
2657,Here’s my current order till PS season is over ☺️,starbucks,10
2658,Two questions burning inside me,starbucks,5
2659,the most (near) perfect flat white i’ve ever made 😫😫😫😫,starbucks,10
2660,Laxman Narasimhan named as next CEO of Starbucks,starbucks,8
2661,Thank You For The Puppy Birthday Magic!,starbucks,7
2662,"Y’all loved our pepto bismol cake pops, but will y’all love our Pastel Pink Cake Pops?",starbucks,18
2663,I salute you all this fall,starbucks,6
2664,Apple crisp frappe,starbucks,3
2665,Random question/ thought:,starbucks,3
2666,RIP,starbucks,1
2667,this is my pay in northern ca. how does this compare to your area? do you feel it's fair pay?,starbucks,21
2668,Someone requested just a few pounds of Sumatra...,starbucks,8
2669,Decorating Board,starbucks,2
2670,rude,starbucks,1
2671,Time to cash in ??,starbucks,4
2672,I have a shift interview next week! Any advice or tips?🥲🤌🏼🤠,starbucks,11
2673,Apple Oatmilk Macchiato 🍎,starbucks,3
2674,is the iced apple oat milk macchiato supposed to look like this? it just tasted a bit off with no distinct apple flavor. Still appreciate all baristas...just curious,starbucks,29
2675,If you get the Apple Crisp Macchiato get Caramel Drizz instead of Apple Drizz,starbucks,14
2676,What are your most elaborate Starbucks orders?,starbucks,7
2677,Starbucks names a new chief executive.,starbucks,6
2678,new dress code,starbucks,3
2679,"Omg Starbucks, seriously!? If you’re going to post “secret menu” stuff then PLEASE actually make recipe cards and put a button on the POS. People are going to ask for this and NO ONE is trained to make it. It’s only the few of us that happen to already know how to make this.",starbucks,56
2680,Can't find this in IMS...,starbucks,6
2681,What do you guys think?,starbucks,5
2682,What do you think of our newest green bean?,starbucks,9
2683,Cube recipe for PSC?,starbucks,4
2684,CANADIAN BARISTAS: How to recreate the legendary apple oat flat white?!,starbucks,11
2685,is this illegal?!,starbucks,3
2686,Training my first barista next week,starbucks,6
2687,the other day,starbucks,3
2688,This is what I’ve grasped about the Pumpkin Spice flavoring this year 2022,starbucks,14
2689,Is there really no way to tip through the app any more?,starbucks,12
2690,got this special order today. he’s still alive btw. but there was absolutely no room for milk 💀 and we were super busy as well,starbucks,25
2691,Short pumpkin pumps?,starbucks,3
2692,Coffee passport? Coffee Master?,starbucks,4
2693,SSV faced with LOA or a wrongful write up. Issues with getting disability pay. Can anyone help me?,starbucks,18
2694,In the middle of the forest,starbucks,6
2695,He was adamant he have this,starbucks,6
2696,Ice in drinks rant...,starbucks,4
2697,what’s the milk to water to chai base ratio?,starbucks,10
2698,Short rant. ( ASM),starbucks,3
2699,Amazing sign at my local store,starbucks,6
2700,Starbucks Fall Beverages are back everyone! 🍂⭐️☕️,starbucks,6
2701,How to order 4 espresso shots,starbucks,6
2702,Fan Art,starbucks,2
2703,Great Fan Art IG Story,starbucks,5
2704,Fall Art,starbucks,2
2705,new dress code?,starbucks,3
2706,"Baristas, how do I ask for this without seeming rude?",starbucks,10
2707,All the starbucks in Dallas have been out of the spinach feta wrap for weeks 😔,starbucks,15
2708,thankful every day i got out of this shit 😭 thank y’all for your service,starbucks,15
2709,What are the black specs on this?,starbucks,7
2710,Keeping Benes,starbucks,2
2711,I’m in love with the new Autumn cups here in the UK 😍🎃,starbucks,13
2712,This was @630am 🫠,starbucks,3
2713,# 33,starbucks,1
2714,do all starbucks partners get paid at least 15$ an hour?,starbucks,11
2715,How do I order this?,starbucks,5
2716,venti rant i am so tired,starbucks,6
2717,asm won’t schedule me,starbucks,5
2718,cup sleeves 😔,starbucks,2
2719,Why does Starbucks don't have any return trays?,starbucks,9
2720,now an official Starbucks barista!,starbucks,5
2721,the egg bites have come to the uk,starbucks,8
2722,confused about w4,starbucks,3
2723,international menu items,starbucks,3
2724,Autumn Blend arrives in UK,starbucks,5
2725,Is there ginger in the pumpkin spice products?,starbucks,8
2726,Drive through people,starbucks,3
2727,Difference between tall and grande PS cold brew?,starbucks,8
2728,قهوه نوشیدنی مورد علاقه جهان و 6 دلیل برای این محبوبیت,starbucks,11
2729,رمان قهوه قبل از سرد شدن,starbucks,6
2730,My friend text me that the new seasonals were out and I literally jumped out of bed and ran to my local,starbucks,22
2731,Riiight?,starbucks,1
2732,Starbucks (Japan) date is the best with Starbucks &lt;3,starbucks,10
2733,WHY AM I HAVING SO MUCH TROUBLE GETTING REHIRED need tips pls,starbucks,12
2734,Gold rewards after 12 months?,starbucks,5
2735,Where do I check how much sick time I have and how can I use all of it in a row?,starbucks,21
2736,this owl cake pop has seen some things,starbucks,8
2737,Pumpkin Spice,starbucks,2
2738,Is there a video tutorial on how to assemble travellers?,starbucks,10
2739,Baristas: What's your favorite drink to make?,starbucks,8
2740,Fall drink suggestions?,starbucks,3
2741,Happy pumpkin y’all! Here is a board I did for my store 🎃❤️,starbucks,13
2742,Dress code,starbucks,2
2743,Pike Place® Roast,starbucks,3
2744,Fun new drink???,starbucks,3
2745,Bacon Gouda... Now smaller!,starbucks,4
2746,Should I stay until after training is complete?,starbucks,8
2747,New drink inclusion 😍? Found this in my water when I went to get my drink on launch day &lt;3,starbucks,20
2748,"New fall go to drink: venti matcha latte with 5 scoops matcha, two pumps chai and pumpkin cold foam. Soooo good!",starbucks,21
2749,Where are the fox cake pops!?!?? Wtf!?,starbucks,7
2750,Almost done with training,starbucks,4
2751,is asu worth it?,starbucks,4
2752,Pumpkin cream cold foam does not taste the same this year.,starbucks,11
2753,How to get hired!!??,starbucks,4
2754,Not Oatly oat milk,starbucks,4
2755,Customer Connection Advice,starbucks,3
2756,Baristas Working Fall Launch - Y’all Are Killing It,starbucks,9
2757,Would I get fired for posting a tiktok on how to make a pumpkin spice latte?,starbucks,16
2758,In the back room,starbucks,4
2759,"Restroom cleaner usage other than bathrooms, sinks, and matts",starbucks,9
2760,asm wont schedule me,starbucks,4
2761,will there be a gingerbread biscotti this year?,starbucks,8
