,title,subreddit,words_in_sentence
0,"My new favorite 50 stars drink! Caffe misto with oat milk, pumpkin cold foam, 2 pumps of vanilla and 2 pumps of pumpkin!",starbucks,23
1,How does your store handle partners buying merchandise?,starbucks,8
2,8am.. 🤦🏻‍♀️,starbucks,1
3,Looking for the gay male baristas?,starbucks,6
4,Reasons why I hate my job.,starbucks,6
5,Sooo today somebody got a mocha cookie frappucino with no ice and ummmm I hope they’re okay. Anyways how’s yalls day? Lol,starbucks,24
6,Is there a reason the pumpkin foam is much less thick recently?,starbucks,12
7,Question about the cheese danish,starbucks,5
8,Be careful who you call ugly in middle school 😬,starbucks,9
9,"Black specks in bottom of Strawberry Açaí refresher, anyone know what it could be?",starbucks,14
10,so... our store got broken into,starbucks,6
11,Changed the beans?,starbucks,3
12,This is what I want to show everyone who says “all you do is make coffee; how hard can it be?”,starbucks,21
13,Frappachino extra shot (what about the frappe roast),starbucks,8
14,T H E C U B E,starbucks,7
15,"So grateful for my baristas this morning. Kittens knocked my drink off the table being wild, and they comp’d me a new one 😭",starbucks,24
16,drive thru cat,starbucks,3
17,Normal for baristas to have an average of 15 hours a week? (Anyone over 25 hours is a shift),starbucks,19
18,Pumpkin cream cold brew is almost never made properly.,starbucks,9
19,little girl ordered the Under the Sea refresher,starbucks,8
20,Baristas- What is your favorite and least favorite position and why&gt;,starbucks,12
21,i have to take a leave of absence?,starbucks,8
22,They got rid of the grilled chicken and hummus box a few weeks after I posted a meme like this on here. Just trying something now...,starbucks,26
23,Joining the supervisors,starbucks,3
24,any other georgia baristas feeling the evacuation traffic?,starbucks,8
25,Put in my two weeks and I’m so happy I never have to get sprayed with whipped cream again,starbucks,20
26,didn't tip,starbucks,3
27,WHY WOULD THEY DO THIS,starbucks,5
28,"So simple, so appreciated :) Especially during morning rush!",starbucks,8
29,Just accepted a job offer as a manager! ….with absolutely no experience.,starbucks,12
30,I am very confused about the starbucks ASU program.,starbucks,9
31,Vacation Paid Out,starbucks,3
32,Starbucks Japan secret menu Choco special frapuccino,starbucks,7
33,"I don't understand what's so bad about working at sterbucks, can someone please ELI5?",starbucks,16
34,"I don't understand what's so bad about wkeking at Starbucks, can someone please ELI5?",starbucks,16
35,Recently offered contingent offer &amp; have passed BG check. Further details in post,starbucks,13
36,"a month ago, I went thru for a standard matcha latte and received the wrong order of matcha w/oat milk and sweet cream cold foam… I have not stopped ordering this drink since 😂💚",starbucks,34
37,Has anyone used this Pour Over Set?,starbucks,7
38,Managers only letting baristas work 4 hour shifts,starbucks,8
39,Two questions for current baristas: the hot apple drink and the minty mocha drink,starbucks,14
40,"""Either pose or move""",starbucks,4
41,I didn’t get my coffee,starbucks,6
42,Easiest Drinks To Make?,starbucks,4
43,Remodel in a rural area,starbucks,5
44,Anyone found the GITD Keychain,starbucks,5
45,how many years we saying till bye bye Starbucks?,starbucks,9
46,next steps?,starbucks,2
47,Has anyone claimed a shift for coverage when they are still in training?,starbucks,13
48,Denied time off,starbucks,3
49,Iced Coffee with Milk ordering advice,starbucks,6
50,Time Off Denied,starbucks,3
51,Little things that make the day go by faster 🫠,starbucks,9
52,London fog tea latte,starbucks,4
53,"Worker Comp injury from Dec. 6, 2019 causing me to be disabled ever since. ***TW!!!***",starbucks,15
54,"Our store is getting the new machines tonight, how much of the old machine can I keep",starbucks,17
55,177XXXX Partner hanging up the [black] apron,starbucks,7
56,how to use sick time?,starbucks,5
57,How Starbucks can improve and why?,starbucks,6
58,question on how to go about calling off,starbucks,8
59,Hurricane Ian,starbucks,2
60,I am just gonna leave this here!!!,starbucks,7
61,Taxes on Referral Bonus?,starbucks,4
62,How long until partner discount goes away after quitting?,starbucks,9
63,promoting to ssv,starbucks,3
64,New Partner Here,starbucks,3
65,Venti rant? I really hate some of my coworkers,starbucks,9
66,I almost passed out on the floor (again). Looking for ways to set boundaries so I stop feeling guilty,starbucks,19
67,How long does it take for ethics to respond to complaints?,starbucks,11
68,"first day of training tomorrow, any tips?",starbucks,7
69,PSL with no whip means pumpkin foam art,starbucks,8
70,:3 pls drop some advice!,starbucks,5
71,:3 pls drop some advice!,starbucks,5
72,SSVs/SMs: what is your store’s system for printing and filling out DCRs?,starbucks,14
73,Middle aged Starbucks noob looking for drink suggestions. I know nothing about fancy coffee drinks because I've always just went to Dunkin. I tried the Vanilla Sweet Cream Cold Brew. Meh. Next the Caffe Vanilla Frappuccino. It was heavenly.... but a little too much like a coffee milkshake....,starbucks,49
74,HEALTH BENEFITS OF COFFEE.,starbucks,4
75,I actually need help lmaoo,starbucks,5
76,Does anyone know where I can get Starbucks cascara syrup?,starbucks,10
77,SpongeBob mcloafpants,starbucks,2
78,Customers raging when told we are out of something,starbucks,9
79,Left the siren over a year ago and was ordering office supplies today. It follows 😭,starbucks,15
80,Caffeine help.,starbucks,2
81,Spotify family plan.,starbucks,3
82,Trenta!???,starbucks,1
83,Creep,starbucks,1
84,How long has the caramel ribbon crunch not had crunchies at the bottom with the whip????,starbucks,16
85,Does anyone know of any matcha powders you can buy that taste similar to the Starbucks one?,starbucks,17
86,Locations with seating,starbucks,3
87,can i bring my own reusable water bottle and get it filled with water? or do i have to order a separate cup,starbucks,23
88,why 💀💀💀,starbucks,1
89,Coffee Master and Coffee Academy?,starbucks,5
90,I present to you the thing that made me happy today. Starbucks on a flip phone.,starbucks,16
91,This was the scone I got from Postmates... never again,starbucks,10
92,expectations,starbucks,1
93,Reusable cups,starbucks,2
94,"Peacefully, Queen gena de' Medici Etherton birthdate: September 24, 1962'",starbucks,10
95,"Peacefully, Queen gena de' Medici Etherton birthdate: September 24, 1962'",starbucks,10
96,"Peacefully, Queen gena de' Medici Etherton birthdate: September 24, 1962'",starbucks,10
97,Medici Etherton Code CodeX Leonardo da' Vinci,starbucks,7
98,"Google/Alpha-bet wished Queen gena de' Medici Etherton Happy Birthday 3 times: 2014, 2015, and 2016. Peacefully, Queen gena de' Medici Etherton",starbucks,23
99,"Peacefully, Queen gena de' Medici Etherton birthdate: September 24, 1962'",starbucks,10
100,"The 'M' is for Medici (Medici-ne ), as Leonardo da' Vinci is a Medici CodeX Leonardo da' Vinci",starbucks,18
101,"Mona Lisa is between Lake Washington and Puget Sound, Seattle, Washing-ton state America",starbucks,14
102,I hate the grande/venti dome lids!,starbucks,7
103,I quit today.,starbucks,3
104,cheaper alternative for an iced caramel macchiato?,starbucks,7
105,glow in the dark cup. 🔥🔥🔥,starbucks,5
106,Starbucks Holiday Menu The Same As Last Year.,starbucks,8
107,Starbucks Holiday Menu 2022 the same as last year...,starbucks,9
108,Starbucks Holiday Menu for 2022 same as last year,starbucks,9
109,Starbucks Holiday Menu 2022 the same as last year,starbucks,9
110,Starbucks Holiday Menu 2022 Same as Last Year,starbucks,8
111,"The Starbucks Holiday Menu 2022 REVEALED, but the same as last year ???",starbucks,12
112,"The Starbucks Holiday Menu 2022 REVEALED, but the same as last year ???",starbucks,12
113,is there espresso in this matcha or is it just Brownish for some reason,starbucks,14
114,perfect peach juice dupe!!,starbucks,4
115,Starbucks Rewards Study!,starbucks,3
116,Gift to Baristas?,starbucks,3
117,please tell me I'm right about this...,starbucks,8
118,Impossible Breakfast Sandwich Shortage?,starbucks,4
119,Any Starbucks in the ATX area have glow in the dark cups?? Or Halloween cups? I know today was the official release date.,starbucks,23
120,are we allowed to get a food markout on a day we're not scheduled?,starbucks,15
121,Why do you guys love your jobs so much?,starbucks,9
122,White hot chocolate help,starbucks,4
123,Cold Brew with Milk or Splash of Milk?,starbucks,8
124,With Milk or Splash or Milk?,starbucks,6
125,I found this in a German supermarket. It’s absolutely delicious.,starbucks,11
126,Can corporate Starbucks guarantee full time hours?,starbucks,7
127,Syrup Dupes,starbucks,2
128,Does anyone know details of the Starbucks 6 week paid maternity leave? My understanding was even a part-time worker at 20hrs a week after 90 days could become eligible for maternity leave pay. I was told Sedgwick cannot consider my claim until I have been with Starbucks a full year.,starbucks,51
129,Getting fired??,starbucks,2
130,first pup cup of the day goes to this dog,starbucks,10
131,Anyone else a tad bit upset the free birthday treat only applies on your birthday. It used to last a month… I missed out.,starbucks,24
132,Ran my first practice shift today as an ssv,starbucks,9
133,It’s happening….,starbucks,3
134,Anyone else feel that Starbucks has a much better tasting iced coffee compared to Dunkin?,starbucks,15
135,Working at Starbucks?,starbucks,3
136,Should I order the coffee or creme version of the Apple Crisp Oatmilk Frappuccino?,starbucks,14
137,We made a tiktok based on this post.,starbucks,8
138,It almost happened again. 🤦🏻‍♀️,starbucks,4
139,Cup funds,starbucks,2
140,Grande in a venti cup standards,starbucks,6
141,Starbucks cup fund,starbucks,3
142,Starbucks is a SHIT company to work for,starbucks,8
143,Black coffee??,starbucks,2
144,"17 partners quitted during the 5 months that I've been here, is this normal?",starbucks,15
145,Does Starbucks not sell lemonade?,starbucks,5
146,RIP sweet cream,starbucks,3
147,How to deal with panhandlers?,starbucks,5
148,"Starbucks is legally forced to give union employees all benefits announced to non-union employees, the government's NLRB said.",starbucks,20
149,Just applied!,starbucks,2
150,Mostly for later post but anyone in the ATX area get a shipment of Glow in the Dark cups?? Lemme know!:) I know today is the actual release date.,starbucks,29
151,Is the Starbucks app for iOS older than Android,starbucks,9
152,I hate this job,starbucks,4
153,Incident report? TW SA!,starbucks,4
154,Job application keeps getting sent back IMMEDIATELY?,starbucks,7
155,no manager response after 20 days😭,starbucks,6
156,A tad bit rude customer,starbucks,5
157,Pup cup add wasp pls,starbucks,5
158,Oopsie closer,starbucks,2
159,Is the ASU tuition worth it?,starbucks,6
160,I love fall,starbucks,3
161,Why do a lot of starbucks workers complain about having to do their job?,starbucks,14
162,First time PSL question,starbucks,4
163,Literally just venting / I'm tired,starbucks,6
164,Extra caramel drizzle,starbucks,3
165,Starbucks Announces a Non-Coffee Addition to Its Grocery Lineup: Pink Drink is Comikg to Grocery Stores!,starbucks,17
166,Question About Onboarding,starbucks,3
167,is there a limit on transfers a year?,starbucks,8
168,This job has broken my spirit.,starbucks,6
169,that awkward moment when,starbucks,4
170,decaffing rude customers?,starbucks,3
171,how does it make sense that the training process became 2x as long &amp; intensive but the bonus remained the same?,starbucks,21
172,Can’t tell if this person loves coffee or hates it,starbucks,11
173,"if your corporation is going to keep firing employees over social media posts, maybe start addressing just how serious you are at all meetings and in all handbooks. maybe give good employees a warning before firing",starbucks,36
174,what are grounds for banning a customer?,starbucks,7
175,roach update,starbucks,2
176,Going to work during a hurricane???,starbucks,6
177,tips for a newbie?,starbucks,4
178,"Damn you, Pineapple base",starbucks,4
179,Starbucks way too much ice from dis ey world.,starbucks,9
180,Are Nike Air Max’s good sneakers for this job?,starbucks,10
181,Why no whip?! Pt. 2,starbucks,5
182,I quit. (Update on using expired ingredients story.),starbucks,8
183,Just a little brown sugar,starbucks,5
184,Pumpkin foam recipe,starbucks,3
185,new travel mug is absolutely useless,starbucks,6
186,Is anyone else in Canada having issues accessing the Omni app and website for Desjardins group insurance login?,starbucks,18
187,application question,starbucks,2
188,supervisor issues,starbucks,2
189,Confusing Expiry message. Anyone know what the 2605 means? I have 120 stars expiring.,starbucks,14
190,now what?,starbucks,2
191,How y’all SSVs be doing your 3hr pulls in 30 minutes?,starbucks,12
192,Winter Menu Coming November 2nd,starbucks,5
193,the new starbucks fall drinks😍😍,starbucks,5
194,Question about tenure raises,starbucks,4
195,Looking for store in San Jose,starbucks,6
196,Safeway Starbucks told me I can’t use stars to get a cup until it’s been out for two weeks. Is that true? I feel like I’ve gotten cups on the release day before…,starbucks,36
197,368 signing off 🤭,starbucks,3
198,tips for the food and safety test?,starbucks,7
199,This is so funny. You guys have to watch this,starbucks,10
200,Tired and ill.,starbucks,3
201,closing for hurricanes?,starbucks,3
202,Phoenix U reimbursement?,starbucks,3
203,What is a “typical” customer connection score for each store/for the company?,starbucks,13
204,Sorry we weren't open for your 3 AM coffee ma'am,starbucks,12
205,Mobile orders being stolen,starbucks,4
206,I had 300 stars disappear from my account overnight?,starbucks,9
207,What are the unspoken (or spoken) etiquette rules of patrons doing work in your store?,starbucks,15
208,"hi, i've got a quick question for barista's!",starbucks,10
209,“Can I get a tall (insert ice drink) with no ice and a venti cup of ice”,starbucks,17
210,Tall (insert ice drink here) no water and a venti cup of ice moment,starbucks,14
211,Are we loosing benefits?,starbucks,4
212,sweetest matcha I've ever had,starbucks,6
213,A barista made my day and I want to repay her.,starbucks,11
214,Don't you love when people make massive assumptions? look I ordered right. I just asked for the drink I never asked for it cold. they somehow thought it was a cold drink. I've made another comment listing some of the issues from this particular Starbucks.,starbucks,47
215,"what happened to my beloved everything bagel? i checked 3 different stores and it's gone from the app, even though we very much have it",starbucks,26
216,transfer problems,starbucks,2
217,Canadians - can you redeem star rewards in airports?,starbucks,8
218,"""I'm going to find a different Starbucks!""",starbucks,8
219,Weird way to tip,starbucks,4
220,starbucks coffeegear not letting me sign up,starbucks,7
221,would you like a side of invasive species with your frap today?,starbucks,12
222,my store manager wrote me up for being negative,starbucks,9
223,Need drink recommendations,starbucks,3
224,Just three awful drinks I’ve gotten in the past few days.,starbucks,12
225,Can anyone help identify/source this cup?,starbucks,7
226,Can anyone help locate/identify a cup?,starbucks,7
227,Confused customer here!,starbucks,3
228,Milk runs are my favorite because of all the weird looks I get in the store,starbucks,16
229,Best/safest way to strip the rest of this film/coating on my Starbucks glass cup?,starbucks,16
230,What would be the best way to verbally say the changes to this grande iced mocha? My campus Starbucks doesn’t do order ahead and I’m not sure how to say this in the best and least confusing way for everyone involved. (Or should I just find another drink haha),starbucks,51
231,dropped my cup and it became Two,starbucks,7
232,tall rant,starbucks,2
233,Asking for a friend 🤠🙄,starbucks,4
234,Which one is better to get?,starbucks,6
235,Ahh yes... a Cold Carmel apple spice...,starbucks,7
236,Do coverage shifts pay the same as keyholder shifts?,starbucks,9
237,Can I get fired? Sick for the past few days.,starbucks,10
238,"All Starbucks in my area are out of iced coffee, and some don’t have cold brew, any idea why?",starbucks,20
239,Venti iced chai with ONE PUMP of chai (no ice),starbucks,10
240,partner discount question,starbucks,3
241,Best matcha recipe!! (From a barista),starbucks,6
242,"If I order an iced double shot shaken espresso and ask for sugar free caramel syrup, do the baristas still automatically put in the 3 standard pumps of sugar syrup in the process?",starbucks,33
243,I called out bc I think I have food poisoning,starbucks,10
244,Good morning,starbucks,2
245,Missing something that I can’t have back,starbucks,8
246,it's been a week and my manager hasn't notice 🙃,starbucks,11
247,i hope the customer was satisfied😭,starbucks,6
248,Please Educate Me,starbucks,3
249,Just argued with another stores SM and found out I'm going there for support tomorrow.,starbucks,16
250,Y’all ever checked the reviews of our starbucks apps?,starbucks,10
251,Pumpkin sccf,starbucks,2
252,I tried the amazing looking strawberry cream pie with a dark mocha chip Frappuccino. Sweet and sour and delicious.,starbucks,19
253,Interview tomorrow - any tips?,starbucks,4
254,thinking of applying,starbucks,3
255,thinking of applying,starbucks,3
256,Thanksgiving blend pairing ideas,starbucks,4
257,Do I have to tell my store manager I'm applying as shift at another store?,starbucks,16
258,How do I know which drinks are shaken?,starbucks,8
259,Will Starbucks help me get a visa?,starbucks,7
260,"Baristas, do you prefer to pull your stickers?",starbucks,8
261,Can I change my availability if I’m a new hire?,starbucks,11
262,how do I stop from burning myself? Does anyone get oven mitts?,starbucks,12
263,More pictures relating to previous post,starbucks,6
264,What shoes are allowed to be worn,starbucks,7
265,master your craft training?,starbucks,4
266,"I repeated this abomination 3 times and got confirmation, she took it, went back through the drive-thru and told us to remake it bc she wanted ""mocha drizzle not lining"" 😍",starbucks,31
267,r we allowed do bean markouts for partners out of store,starbucks,11
268,Screaming. Crying.,starbucks,2
269,Bottled Frappucinos with Low Sugar,starbucks,5
270,some questions,starbucks,2
271,"If Starbucks had character archetypes, what would some of them be?",starbucks,11
272,Does Starbucks trans benefits work in canada ? Or just the us ?,starbucks,11
273,PSA: Credit Card Tips!,starbucks,4
274,I hate being dismissed,starbucks,4
275,Can someone please make me a drink worth this much after tax 😩,starbucks,12
276,Caramel ribbon crunch topping?,starbucks,4
277,SM coming in on day off to bitch at us,starbucks,10
278,I made an Oreo macchiato (only espresso and milk),starbucks,9
279,If your brakes squeal,starbucks,4
280,Bar Tips please,starbucks,3
281,What the heck?,starbucks,3
282,Bar Tips Pls,starbucks,3
283,Forbidden Mocha Tower🗼,starbucks,3
284,How do I deal with a toxic store?,starbucks,8
285,"Purchasing syrups, etc?",starbucks,3
286,This was my sign that my shift was going to be alright,starbucks,12
287,god i love the owl cake pop,starbucks,7
288,Thinking of applying to a hyvee Starbucks I worked tarbucks and official stores.,starbucks,13
289,Non popular drinks?,starbucks,3
290,why 😫,starbucks,1
291,asm promotion,starbucks,2
292,For a long time,starbucks,4
293,some special trenta lids,starbucks,4
294,Looking to try and get shoes for work.,starbucks,8
295,starbucks playlists,starbucks,2
296,drizzies,starbucks,1
297,it’s time for your ten. what are you having?,starbucks,10
298,My Starbucks journey so far,starbucks,5
299,Need your tips!,starbucks,3
300,Tall Rant in a Venti Cup,starbucks,6
301,reapplying,starbucks,1
302,My favorite thing! As a vegetarian this is my life saver when I take my breaks. It's so good! Better than the impossible imo.,starbucks,25
303,Re-enroll in benefits every year??,starbucks,6
304,cancer,starbucks,1
305,"If you are a veteran barista and you can only work one position, what are you still doing here?",starbucks,19
306,Is there any way to order a plain latte on the app?,starbucks,12
307,I'm so tired of this,starbucks,6
308,New pretty! The holo effect is so cool,starbucks,8
309,Now pretty! The holo effect is so cool,starbucks,8
310,pov: you can't quit but you still gotta satisfy the urge 😔,starbucks,12
311,How to do a food pull?,starbucks,6
312,Is working at a Starbucks inside another store worth it?,starbucks,10
313,Happy 10 year anniversary of the announcement of the reward change where they got rid of free syrups and dairy milks. 💀,starbucks,21
314,Any idea why the Dark Chocolate Covered Grahams don’t show up on the app?,starbucks,15
315,Any idea why the Dark Chocolate Covered Grahams don’t show up on the app at all?,starbucks,17
316,only way to cook a sausage egg and cheddar,starbucks,9
317,starbucks customers learn how to order challenge,starbucks,7
318,"I have felt some type of way about this ""hack""",starbucks,10
319,definitely feel like I’m done here,starbucks,7
320,the most WILD customer interaction i’ve ever had:,starbucks,9
321,Help for how to report my Store Manager’s behavior,starbucks,10
322,Bonus star CONSPIRACY,starbucks,3
323,Pumpkin shaken espresso?,starbucks,3
324,Can I file an incident report about another SSV?,starbucks,9
325,For the customers on here,starbucks,5
326,Will I get in trouble for wearing a Coffee Master apron without having earned one?,starbucks,15
328,The spelling myth is true.,starbucks,5
329,I want to cry,starbucks,4
330,"This lady got her order confirmed 2 times then still complained and made us remake it because she wanted mocha drizzle, not lining 😍",starbucks,23
331,Pumpkin Sweet Cream Cold Brew,starbucks,5
332,"does anyone know what it looks like when your sick hours are used? i told my manager and she said ok, i’m only asking because i really need my hours for my next paycheck.",starbucks,35
333,Do we get paid an extra $15 if we take shifts?!,starbucks,11
334,New dress code,starbucks,3
335,How do y’all line cups????????,starbucks,6
336,Is it normal to have a hard time after training?,starbucks,10
337,"My favorite Starbucks drink: grande Caramel Frap Extra ice and extra whipped cream, affogato style… usually the baristas will put it on a venti cup for the extra whipped",starbucks,29
338,he is watching you,starbucks,4
339,What has your experience been with calling ethics and compliance? Wondering how likely it is that I’ll face negative repercussions if I decide to give them a call.,starbucks,29
340,Starbucks is just teasing us at this point. Haven’t been able to find an almond croissant in 2 months.,starbucks,20
341,Dear Starbucks,starbucks,2
342,"Stupid question: If I were to order a regular coffee with, say, chestnut praline powder added, would it be able to mix into the drink or would it not really affect the flavor of it?",starbucks,35
343,Is it normal for your manager to call you to ask why you called out?,starbucks,15
344,does my store have to accept my availability hours for work or can they transfer me to another store?,starbucks,19
345,do SMs fire partners to make themselves look better?,starbucks,9
346,"30 minutes into opening, customer called ahead for 24 turkey bacon sandwiches and 2 coffee travelers for 8:30am!",starbucks,19
347,help needed applying for leave of absence?,starbucks,7
348,Fired for not working the minimum hours,starbucks,7
349,Is this really a thing?,starbucks,5
350,"if im already part of sbux insurance, do i have to apply for it again or will it do it automatically",starbucks,21
351,I like to recommend drinks to customers and one girl loved hers so much she drew a picture of it 🥺,starbucks,20
352,Cup discount/using stars??,starbucks,4
353,health/dental benefits enrollment,starbucks,4
354,Can I report my SM for this? And who to?,starbucks,10
355,So everybody just getting attacked by rock man huh?,starbucks,9
356,are tights with designs in dress code?,starbucks,7
357,Are the headsets only meant to go on the right side of your head?,starbucks,14
358,Did I get scammed again?,starbucks,5
359,best friend is a partner,starbucks,5
360,“Imma have you go on cold bar today”,starbucks,8
361,Ethiopia Core Coffee Tasting!,starbucks,4
362,Is McDonald’s Double Caramel Iced Latte better than Starbucks at a fraction of the price?,starbucks,16
363,Can I order the the apple crisp macchiato with whole milk?,starbucks,11
364,Tattoos &amp; Piercings?,starbucks,3
365,Has anybody tried this?? I’m so tempted 😩,starbucks,8
366,Time off!?,starbucks,2
367,What’s with people saying MDRL when they mean DD?,starbucks,10
368,Didn’t close back door the right way,starbucks,8
369,What is the weirdest thing that has ever happened at your store?,starbucks,12
370,I got a name tag but it’s a pin.. my shifts say it should be fine but is it really?,starbucks,21
371,f*ck this saturday,starbucks,4
372,my store has *roaches* and our DM said he didnt care lol,starbucks,12
373,former 272 here - does anyone know if these little shot glasses were available for public sale?,starbucks,16
374,How long does it take for somebody to get back to you regarding an ethics complaint?,starbucks,16
375,We had clean mop heads.,starbucks,5
376,Today. Was. Brutal.,starbucks,3
377,Do Starbucks workers sometimes give less espresso if busy?,starbucks,9
378,cordusio + customer attitude,starbucks,3
379,To become an SM or not…,starbucks,6
380,well then. another day.,starbucks,4
381,So this has been my shift today. DM won't let us close. Drive Thru Only,starbucks,16
382,question about the refer a friend award on the app,starbucks,10
