,title,subreddit,words_in_sentence
111,I work at Dunkin’ in Georgia; AMA! ☕️🍩,DunkinDonuts,7
112,Survey for school.,DunkinDonuts,3
113,Imagine going to a movie theater and asking for a soda with no ice so they only fill the cup half way,DunkinDonuts,22
114,Look what came in today 👀,DunkinDonuts,5
115,enjoying Dukin this morning and remembering back in the day when I was a crew member you had to have a sharpie on you at all times so you could write the drink order on every cup.,DunkinDonuts,37
116,The Dunkin Donuts Girl by STEELPRAUD...it['s an R&amp;B song,DunkinDonuts,13
117,Are there ever any powdered sugar donuts?,DunkinDonuts,7
118,Florida man leaving Dunks after 3 years and 5 stores. (Q&amp;A),DunkinDonuts,13
119,Closing without a shift lead?,DunkinDonuts,5
120,Allergies and allergens?,DunkinDonuts,3
121,am I in the wrong for not wanting to open alone with a new employee who has never opened before?,DunkinDonuts,20
122,I worked at a dunkin in nj. ask me anything,DunkinDonuts,10
123,Is the brown sugar cinnamon flavor a regular now?,DunkinDonuts,9
124,Cups are awful?,DunkinDonuts,3
125,I messed around with the Dunkin' Donuts 1960's logo.,DunkinDonuts,10
126,Late night coffee,DunkinDonuts,3
127,Employee: Why does Dunkin get rid of everything good/general pet peeves?,DunkinDonuts,12
128,How many cream and sugar for “Light and Sweet”?,DunkinDonuts,9
129,Making Dunkin iced coffee at home!,DunkinDonuts,6
130,"Hi, can I get an iced regulah and a strahberry frahsted?",DunkinDonuts,11
131,Weird new upcharge policy?,DunkinDonuts,4
132,Help I need to know if this is normal,DunkinDonuts,9
133,Can I get nutty pumpkin but in cold brew?,DunkinDonuts,9
134,Why is Dunkin’ Donuts so inconsistent?,DunkinDonuts,6
135,What’s your thoughts about the upcoming change? 500 points for a coffee is a big leap from 200 points,DunkinDonuts,20
136,Closing quickly,DunkinDonuts,2
137,My coworker placing the hash browns like army troops😂,DunkinDonuts,9
138,whats the deal with these?,DunkinDonuts,5
139,Working for dunkin,DunkinDonuts,3
140,How to make the ice tea ordered from door dash taste the same as ice tea ordered directly from the store?,DunkinDonuts,21
141,We still got 4 more hours of shift and this is all we got🤯,DunkinDonuts,14
142,forbidden BP swirl 🙈,DunkinDonuts,3
143,Pumpkin Spice Signature Latte at home,DunkinDonuts,6
144,Does anyone know if the Apple Cider is coming back?,DunkinDonuts,10
145,If you come in here,DunkinDonuts,5
146,Beverage sticker printer jamming,DunkinDonuts,4
147,Is anyone else’s store have trouble with espresso pucks?,DunkinDonuts,10
148,Dunkin Rewards Update,DunkinDonuts,3
149,quick rant,DunkinDonuts,2
150,"this expires today!! I can't use it's, but I'm sure someone else can",DunkinDonuts,16
151,I know it's a shot in the dark,DunkinDonuts,9
152,Accidentally burnt the new brownies that were recently added to the menu..,DunkinDonuts,12
153,Thought you guys might like this action figure I made today.,DunkinDonuts,11
154,Selection in Weston WI,DunkinDonuts,4
155,$2 Dunkin donuts card. First one to save pic and comment will get it. Will delete once I receive comment,DunkinDonuts,20
156,Leaving Dunkin after 3 years and 5 different stores.,DunkinDonuts,9
157,About discontinued flavor swirls,DunkinDonuts,4
158,About discontinued flavor swirls,DunkinDonuts,4
159,$3 md lattes?,DunkinDonuts,3
160,buy syrups?,DunkinDonuts,2
161,Orange Creamsicle?,DunkinDonuts,2
162,Does the pumpkin swirl have nutmeg in it?,DunkinDonuts,8
163,Tried the blueberry shot i”d rate it 6/10,DunkinDonuts,10
164,"$2 Dunkin’ Card, someone please use as I won’t be able to make it. Expires by the end of today!",DunkinDonuts,21
165,FCFS other person didn’t claim! Enjoy your monday :),DunkinDonuts,9
166,"LPT: Add OG sweet cold foam (not pumpkin) to your pumpkin coffee. It tastes like pumpkin pie, complete with Cool Whip on top.",DunkinDonuts,23
167,Is the Extra Extra creamer the same creamer thats used at dunkin locations?,DunkinDonuts,13
168,Dunkin Summer prizes,DunkinDonuts,3
169,"Goodmorning! Dunkin worker here, i have two coupons for 2$ off that i don’t need! Comment your favorite drink and i’ll pick randomly :)",DunkinDonuts,25
170,dunkin’ donuts interview,DunkinDonuts,3
171,Can someone explain to me why my local Dunkin Dougnuts will no longer serve me my donuts?,DunkinDonuts,17
172,Dunkin Donuts T Mobile Tuesday $2 Codes?,DunkinDonuts,7
173,Best ratio/combo for blueberry shot in a M iced latte?,DunkinDonuts,11
174,Finally leaving Dunkin (Q&amp;A),DunkinDonuts,6
175,What's it like working at dunkin donuts?,DunkinDonuts,8
176,BEN AFFLECK AND HENRY CAVILL Have signed extensions for further appearances in the DCEU,DunkinDonuts,14
177,Does anybody know if you can add the employee discount on mobile orders?,DunkinDonuts,13
178,This pumpkin cream cold brew is AMAZING 😩👏🏻 highly recommend this for my Dunkin lovers,DunkinDonuts,14
179,Lots and drive thrus,DunkinDonuts,4
180,Question about artificial sweeteners!?,DunkinDonuts,4
181,T-Mobile Tuesdays $2 Coupon!,DunkinDonuts,5
182,How would I feel about a fast paced environment?,DunkinDonuts,9
183,individual location updates on app.,DunkinDonuts,5
184,Does a standard chai latte include espresso?,DunkinDonuts,7
185,DD perks points not adding,DunkinDonuts,5
186,Rant time,DunkinDonuts,2
187,Let's form a prayer circle for Red/Pink Velvet,DunkinDonuts,10
188,Missing Donuts?,DunkinDonuts,2
189,Anyone know what’s the next coffee promo after $3 pumpkin latte/cold brew ends on 9/13?,DunkinDonuts,18
190,Dunkin Donuts Job,DunkinDonuts,3
191,Screwed using the app,DunkinDonuts,4
192,Birthday Reward sucks,DunkinDonuts,3
193,Sugar Plum,DunkinDonuts,2
194,Best refresher?,DunkinDonuts,2
195,Tips!,DunkinDonuts,1
196,Is it weird that my small town Dunkin for weeks now has disabled all Lattes and the Pumpkin Cold Brew and the Pumpkin swirl for App orders only?,DunkinDonuts,28
197,"Denied overtime, manager said its because i transferred between two stores but they're owned by the same company. is this right?",DunkinDonuts,22
198,Dunkaccino order replacement?,DunkinDonuts,3
199,Waiting in line longer than drive thru?,DunkinDonuts,7
200,Munchkins not showing up on the mobile app's menu?,DunkinDonuts,10
201,Crew member,DunkinDonuts,2
202,Crew member,DunkinDonuts,2
203,Crew,DunkinDonuts,1
204,dunkin’ donuts,DunkinDonuts,2
205,Blueberry crumble iced coffee?,DunkinDonuts,4
206,Is the nutty pumpkin iced coffee any good?,DunkinDonuts,8
207,"There's a website based in NYC (I believe) that sells the original Dunkin Donuts creamer, anyone know it?",DunkinDonuts,19
208,What are some iced drinks that are good for the next day if they are stored in the fridge.,DunkinDonuts,19
209,As a Dunkin’ employee,DunkinDonuts,4
210,"I have a weird kinda personal question, is 13/hour decent for a dunkin assistant manager?",DunkinDonuts,16
211,is the apple cranberry refresher coming back? i have never craved anything more than one of those right now,DunkinDonuts,19
212,Is PB coming back?,DunkinDonuts,4
213,does anyone know if peppermint mocha is coming back,DunkinDonuts,9
214,How's it like working at Dunkin?,DunkinDonuts,7
215,What are some iced drinks that are good for the next day if they are stored in the fridge.,DunkinDonuts,19
216,I need more xD,DunkinDonuts,4
217,friendly reminder,DunkinDonuts,2
218,Your $1 oat milk up charge….,DunkinDonuts,6
219,Coupon Expiration,DunkinDonuts,2
220,Promo codes for new customers Sept 2022?,DunkinDonuts,7
221,I need to vent about their horrible service,DunkinDonuts,8
222,Description of donut flavors,DunkinDonuts,4
223,Did anyone else get this or is it a scam? I’m prompted to put in my email…,DunkinDonuts,18
224,I am so happy. I have maple + pumpkin coffee and real syrup. Tastes like fall :D,DunkinDonuts,16
225,Did they change the ingredients on the pumpkin swirl?,DunkinDonuts,9
226,Did dunkin change their vanilla chai tea? cause I want the one with the powder and now they are saying they only have the syrup 🤦🏾‍♀️,DunkinDonuts,25
227,"Can anyone use my T-Mobile Tuesdays $2 Dunkin card? If so, I will send it to the first person that shows interest!",DunkinDonuts,23
228,Fruit Fly problem keeps getting worse. don't know what to do.,DunkinDonuts,12
229,free $2 gift code. no DD near me &amp; T-Mobile giving them out to customers. reply so I can remove pic,DunkinDonuts,22
230,"If i have a dunkin giftcard, can i use it for delivery? or do i need apple pay or something",DunkinDonuts,20
231,Is Dunkin a deaf friendly part time job to work at?,DunkinDonuts,11
232,decaf?,DunkinDonuts,1
233,One thing I hate about Dunkin’,DunkinDonuts,6
234,Sour cream donuts in Alabama. Has anyone tried these?,DunkinDonuts,9
235,Not getting the free donut coupon when doing the surveys,DunkinDonuts,10
236,Over Doordashers,DunkinDonuts,2
237,"Free drink expires today, 9/4",DunkinDonuts,6
238,can somebody use my DD perks free birthday beverage?,DunkinDonuts,9
239,How to make drinks,DunkinDonuts,4
240,"who should I call about a two month long, (yearly recurring) fruit fly infestation?",DunkinDonuts,14
241,No soup for you,DunkinDonuts,4
242,Bless the employee that created this unit,DunkinDonuts,7
243,Is there another way to hot hold hashbrowns,DunkinDonuts,8
244,cutie in drive thru made my day :),DunkinDonuts,7
245,Try this when on clock!,DunkinDonuts,5
246,Why I don’t give out free sh*t no more!,DunkinDonuts,11
247,Flies in donuts,DunkinDonuts,3
248,Customizing PSL,DunkinDonuts,2
249,Some customers are just awful,DunkinDonuts,5
250,Donut,DunkinDonuts,1
251,"Dunkin free donut, survey receipt question",DunkinDonuts,6
252,Nutrition info for my order,DunkinDonuts,5
253,job applicatioon,DunkinDonuts,2
254,I have questions for Dorrette,DunkinDonuts,5
255,My birthday is September sixth and I didn’t get my free birthday reward yet should I call them,DunkinDonuts,19
256,literally all signs have started fading in Pa this year. Why?,DunkinDonuts,11
257,Resuable Large cup?,DunkinDonuts,3
258,How is the new rewards program better?,DunkinDonuts,7
259,"Ok y’all… I tried the pumpkin cream cold brew and it was so bad. Did I just get a bad one, or is it really this bad?!?",DunkinDonuts,28
260,if you don’t like coffee just say that,DunkinDonuts,9
261,Saw this squirrel at the Dunkin checkout window.,DunkinDonuts,8
262,Employees- Are yall being made to take pictures too?,DunkinDonuts,9
263,Never had Dunkin',DunkinDonuts,3
264,Is the new Pumpkin cold brew any good?,DunkinDonuts,8
265,How to order the most similar thing to this at dunkin?,DunkinDonuts,11
266,As an employee of Dunkin’ Donuts,DunkinDonuts,6
267,Twilight Town Runs on Dunkin,DunkinDonuts,5
268,question for ordering online,DunkinDonuts,4
269,Who do I contact about labor exploitation?,DunkinDonuts,7
270,Question about caffiene in macchiatos,DunkinDonuts,5
271,How do you guys order your iced macchiatos?,DunkinDonuts,8
272,Reward Redemption Warning,DunkinDonuts,3
273,Do you Dunkin employees don’t like doing custom orders,DunkinDonuts,10
274,Insane prices,DunkinDonuts,2
275,How is the new Nutty Pumpkin iced coffee?,DunkinDonuts,8
276,Does anyone know what the right stainless steel lid replacement size for this cup is?,DunkinDonuts,15
277,"I'm a Customer service agent, ask your questions",DunkinDonuts,9
278,Strawberries and Cream Iced Latte was delicious,DunkinDonuts,7
279,How are iced macchiatos supposed to be made?,DunkinDonuts,8
280,WIBTA employee,DunkinDonuts,2
281,Question for employees,DunkinDonuts,3
282,Tip returned?,DunkinDonuts,2
283,How do I order?,DunkinDonuts,4
284,Wet donuts,DunkinDonuts,2
285,Anyone know any free drink codes or promo ?,DunkinDonuts,8
286,I have an interview tomorrow,DunkinDonuts,5
287,What makes the nitro cold brew different from the original?,DunkinDonuts,10
288,QR Dunkin’ drink code in store scan ?,DunkinDonuts,7
289,I feel your pain,DunkinDonuts,4
290,what is the point????,DunkinDonuts,4
291,oat milk increase,DunkinDonuts,3
292,Sugar rush 🎃,DunkinDonuts,2
293,Does anyone else despise making the omelette bites?,DunkinDonuts,8
294,Why don’t any of the Dunkin’s at any of the New Jersey Turnpike Service Areas take the Dunkin app or Dunkin gift cards? Are the a seperate entity or something?,DunkinDonuts,32
295,Don’t know if I should say something?,DunkinDonuts,8
296,"When doing drive through, does the person at the window get to keep 100% of tips?",DunkinDonuts,16
297,Any Fall drink suggestions (that aren't pumpkin)?,DunkinDonuts,8
298,Question for closers!,DunkinDonuts,3
299,"I was just wondering on the app, does anyone know if there’s a way to schedule a mobile order head of time ( like for 1 pm the next day), Or no…",DunkinDonuts,32
300,"Here’s a free drink! Expires tomorrow. I wanted to use it, but my closest Dunkin (40 min away) has had no espresso drinks for weeks:( so I would like for it to at least get used before expiring.",DunkinDonuts,39
301,Could I ask the dunk in employee to out salt in my coffee?,DunkinDonuts,13
302,is that gelatinous mess what snacking bacon should look like?,DunkinDonuts,10
303,I love Dunkin iced coffee but…,DunkinDonuts,6
304,I got one of those Coffee VIP Cards. Feel that its a sign from the Dunkin' Gods 🤣,DunkinDonuts,17
305,Iced cappucino,DunkinDonuts,2
306,?? Is iced cappucino supposed to be only this full??,DunkinDonuts,9
307,Help a Boy Out,DunkinDonuts,4
308,Should this baker be fired?,DunkinDonuts,5
309,Avocado Spread on Bagel,DunkinDonuts,4
310,How come the pumpkin coffee is less expensive than black coffee?,DunkinDonuts,11
311,Dunkin App Zip Code Issue,DunkinDonuts,5
312,vanilla bean flavor,DunkinDonuts,3
313,bread cheese egg bacon sausage potato,DunkinDonuts,6
314,Anyone know if this is legit and in all states?,DunkinDonuts,10
315,Pumpkin Spice Latte tastes strange ?,DunkinDonuts,5
316,Can you buy the unsweetened flavors Dunkin uses?,DunkinDonuts,8
317,Mobile app ordering question,DunkinDonuts,4
318,Monster energy punch at home,DunkinDonuts,5
319,cups/lids are horrible,DunkinDonuts,4
320,Turkey sausage egg and cheese any way to get it cheaper,DunkinDonuts,11
321,"fuck the new hot lids. ik they’re not super new, we’ve had them for like 3 months probably but they SUCK. tired of spilling hot coffee on myself &amp; customers because the lids don’t seal all the way",DunkinDonuts,41
322,Do you get the Mobile Mondays points if you use a reward?,DunkinDonuts,12
323,that's quite the frozen coffee you got there,DunkinDonuts,9
324,"I’ve been working for Dunkin/Baskin for almost 2 yrs now. I’ve been the store opener for a whole 1.5 yr &amp; the management is awful at my store, I’ve tried to talk with the owner of the store to see about a promotion but there’s always an excuse, what do I do?",DunkinDonuts,58
325,Is the Apple Cranberry Refresher not coming back???,DunkinDonuts,8
326,Job &amp; position back!,DunkinDonuts,4
327,This new pumpkin spice signature iced latte is amazing 😩😍,DunkinDonuts,9
328,Apple pay at DT,DunkinDonuts,4
329,9/1 promo,DunkinDonuts,3
330,Looks just like the picture and fits perfectly !,DunkinDonuts,8
331,How long are your breaks?,DunkinDonuts,5
332,Do workers make the sandwiches?,DunkinDonuts,5
333,Am I still expected to work even though I'm sick?,DunkinDonuts,11
334,Infinite food hack??,DunkinDonuts,3
335,Application issues,DunkinDonuts,2
336,Points question,DunkinDonuts,2
337,Sad,DunkinDonuts,1
338,Sadness,DunkinDonuts,1
339,Sadness,DunkinDonuts,1
340,will using a friends birthday drink reward be an issue?,DunkinDonuts,10
341,Still here🙃,DunkinDonuts,2
342,Mangonada..,DunkinDonuts,1
343,How would you fix the pumpkin spice cold foam?,DunkinDonuts,9
344,Pumpkin spice different this year?,DunkinDonuts,5
345,Extra cream cheese?,DunkinDonuts,3
346,why is it some locations will make my frozen coffee with oatmilk and some won't?,DunkinDonuts,16
347,Question about DD Rewards,DunkinDonuts,4
348,Weird app glitch,DunkinDonuts,3
349,Best Dunkin Donuts in NYC?,DunkinDonuts,5
350,"Dunkin Donuts had 18 year old girl arrested, charged for ""stealing food"" because she was taking her shift meal (one sandwich and one drink) before her shift started.",DunkinDonuts,28
351,not my cake but someone REALLY loves Dunkin! credits to The Cake Don in Huntington New York,DunkinDonuts,17
352,only a small sweet tooth😆,DunkinDonuts,5
353,employee drink concoctions?,DunkinDonuts,3
354,Normal at your job location?,DunkinDonuts,5
355,Normal at your job location?,DunkinDonuts,5
356,Clear Avail of All Items! I messed up!!,DunkinDonuts,8
357,i'm so sick of don't you worry by David Guetta and Black Eyed Peas,DunkinDonuts,16
358,Why tf was lemonade seasonal?,DunkinDonuts,5
359,Would you say Dunkin is healthier than Starbucks?,DunkinDonuts,8
360,App not working?,DunkinDonuts,3
361,Salted Caramel Cold Foam Cold Brew question,DunkinDonuts,7
362,Whipped Cream not listed in add ons,DunkinDonuts,7
363,How exactly do I order a healthy medium ice caremel latte?,DunkinDonuts,11
364,What can I ask for that’s similar to the BSC Cold Brew?,DunkinDonuts,13
365,Different milk portions for iced coffee vs cold brew?,DunkinDonuts,9
366,Blood orange refresher,DunkinDonuts,3
367,"I don’t usually care about sports, but fly eagles fly lol 🦅🤩",DunkinDonuts,12
368,I'm having a pumpkin iced Chai latte you cock,DunkinDonuts,10
369,Hot sauce,DunkinDonuts,2
370,How strong is the iced coffee or cold brew supposed to be?,DunkinDonuts,12
371,Cold brew w/sweet cold foam. Yea or Nay?,DunkinDonuts,9
372,expectation vs reality,DunkinDonuts,3
373,expectation vs reality 😭,DunkinDonuts,3
374,I don't think I'm cut out to work here,DunkinDonuts,11
375,Iced Matcha with Chai price,DunkinDonuts,5
376,Favorite refresher flavor?,DunkinDonuts,3
377,Oatmilk or Almondmilk PSL,DunkinDonuts,4
378,No more birthday drinks with updated Rewards?,DunkinDonuts,7
379,"Does the bagel sandwich already have bacon or sausage on it, or do you guys add that when you make it?",DunkinDonuts,21
380,Ingredients in the shots,DunkinDonuts,4
381,New hire advice,DunkinDonuts,3
382,¿Lemon’s?,DunkinDonuts,2
383,dulce de ledge/horchata???,DunkinDonuts,4
384,"Not ""my"" Dunkins. Why is my straw so short? Why is it so watered down? I suddenly have a strong appreciation for my regular store",DunkinDonuts,25
385,"Order multiple shot flavors on the app? Usual order is 2 vanilla, 2 mocha, but app is forcing 1 of each. Thanks!",DunkinDonuts,22
386,gotta love being a manager....,DunkinDonuts,5
387,Does this happen to anyone else,DunkinDonuts,6
388,Unpopular opinion,DunkinDonuts,2
389,Does anyone have a free promo code for Dunkins?,DunkinDonuts,9
390,Does anyone have a free promo code on Dunkins,DunkinDonuts,9
391,sausage brand,DunkinDonuts,2
392,Did Dunkin change their receipe?,DunkinDonuts,5
393,Did Dunkin change their Donut recipe?,DunkinDonuts,6
394,How much matcha would it take to feel the same caffeine from a small iced coffee?,DunkinDonuts,16
395,Bagel bites have no right being this good,DunkinDonuts,8
396,Same syrup but different drinks,DunkinDonuts,5
397,what’s up with the tiny cups? lol coworker and i were messing around and made tiny drinks,DunkinDonuts,18
398,Anyone Know Why Sweet Black Pepper Bacon Sandwich Is Gone?,DunkinDonuts,10
399,Are these good answers for potential interview questions?,DunkinDonuts,8
400,pretty drink i made while it was dead,DunkinDonuts,8
401,App needs to say when location is out of an item,DunkinDonuts,11
402,Leaking coffee with every sip,DunkinDonuts,5
403,Am I the only one?,DunkinDonuts,5
404,Consistently given iced coffee instead of cold brew?,DunkinDonuts,8
405,Local Dunkin scrapes metal pan on ground at drive-thru,DunkinDonuts,10
406,Does anyone have one of these hats or happen to know what brand it is?,DunkinDonuts,15
407,What questions can I expect during a job Interview?,DunkinDonuts,9
408,This was posted in my towns FB group🤢,DunkinDonuts,8
409,Broke costumer,DunkinDonuts,2
410,So I got my usual Dunkin coffee but it's not as sweet as it usually is and has a somewhat bitter taste- any ideas why?,DunkinDonuts,26
411,Mobile Monday’s,DunkinDonuts,3
412,Question about available items in the app,DunkinDonuts,7
413,My first day of Dunkin University !,DunkinDonuts,6
414,"As Mobile Mondays have just started, do I have to order something on multiple Mondays to earn points or do I just have to come in on one of the valid Mondays?",DunkinDonuts,32
415,"I've been going to dunk ever since the establishment became available for me; I order macchiatos because I like strong espresso drinks. I feel like my local Dunkin donuts changed how they make them without me knowing because now, every time I order one, it doesn't have the rich espresso taste.",DunkinDonuts,53
416,Does anyone know if all the cold foams are dairy free?,DunkinDonuts,11
417,Why does pumpkin spice latte require to add vanilla shot in it?,DunkinDonuts,12
418,Update now that my “1 Carmel swirl” has settled…,DunkinDonuts,9
419,Our store's mascot: Solomon the Sprinkle,DunkinDonuts,7
420,Any ideas on how to manipulate the 3$ Pumpkin to taste better,DunkinDonuts,12
421,"One Milk, one pump of caramel…",DunkinDonuts,6
422,"""Assorted"" 🥴 cornbread sucks",DunkinDonuts,3
423,Pumpkin swirl,DunkinDonuts,2
424,"Pumpkin Vanilla Bean Coolatta with Pumpkin Munchkins blended inside, tastes like a pumpkin pie!",DunkinDonuts,14
425,Is the mango pineapple drink gone?,DunkinDonuts,6
426,Mobile mondays are back!!,DunkinDonuts,4
427,"Fellow employees, how do you deal with the back pain?",DunkinDonuts,10
428,Sweet drinks that are calorie mindful?,DunkinDonuts,6
429,Jolene is also a pumpkin fan,DunkinDonuts,6
430,Anyone know what Franken-matcha is?,DunkinDonuts,6
431,Anybody else get kind of sad when they don't have drinkable lids for the cold foam?,DunkinDonuts,17
432,Wtf can’t I tip on the app???,DunkinDonuts,8
433,The sugar fairy came ✨,DunkinDonuts,4
434,CA stupid straw laws,DunkinDonuts,4
435,What brand is their unsweetened syrup?,DunkinDonuts,6
436,$3 Signature Latte,DunkinDonuts,3
437,$3 Signature Latte,DunkinDonuts,3
438,"I prefer to use the $3 promotion to get the pumpkin spiced signature latte over the pumpkin cream cold brew (like it better, had the cold brew yesterday and it was just whatever to me) ..simple pumpkin iced coffee works good for me too",DunkinDonuts,44
439,Is apple cider ever coming back? 😭,DunkinDonuts,6
440,Till,DunkinDonuts,1
441,I WISH I was joking with this bagel right now 🙄,DunkinDonuts,10
442,Any iced coffee fav ideas?,DunkinDonuts,5
443,multigrain bagels?,DunkinDonuts,2
444,No more feedback free donuts?,DunkinDonuts,5
445,Interview Sunday,DunkinDonuts,2
446,Caramel Swirl,DunkinDonuts,2
447,"Hi, I love the hash browns. I need them at my house I’ve been given frozen hashbrowns before and airfried them my self and they were amazing I need to know how to acquire a whole case",DunkinDonuts,38
448,iced Cappuccino,DunkinDonuts,2
449,Peanut Butter Cup swirl,DunkinDonuts,4
450,Extra swirl now includes an upcharge,DunkinDonuts,6
451,Interview tomorrow,DunkinDonuts,2
452,Pumpkin swirl,DunkinDonuts,2
453,🍁☕️ yay!!,DunkinDonuts,1
454,2 people. line wrapped around the building.,DunkinDonuts,7
455,Found this at the new dunkin I work at🤢🤢,DunkinDonuts,9
456,Is it okay to do this?,DunkinDonuts,6
457,First week working at this new dunkin and found something disgusting. Should I report this manager she doesn’t seem to care when I pointed it out to her.,DunkinDonuts,29
458,Horchata Latte?! It's amazing!,DunkinDonuts,5
459,just thought i might make my last dunkin run of the summer and remembered butter pecan doesnt exist anymore,DunkinDonuts,19
460,Brown Sugar Cold Foam and Hummus Toast: In Remorium,DunkinDonuts,9
461,Dunkin shirts for employees,DunkinDonuts,4
462,"Interviewing for manager position today, is my pay expectation reasonable?",DunkinDonuts,10
463,Nutty pumpkin - verdict - it’s good!!!,DunkinDonuts,6
464,Cold brew process,DunkinDonuts,3
465,Given Up on Nitro,DunkinDonuts,4
466,I love Dunkin’ however their alternative milk situation sucks,DunkinDonuts,9
467,"Does only in the app mean you cannot order this in person? Also, will it not be on the menu in the store either? Curious what the point is of an ""in app"" only item.",DunkinDonuts,35
468,Something tells me asking for caramel in this is a sin,DunkinDonuts,11
469,thinking about applying,DunkinDonuts,3
470,i cant reply cause he blocked me💀💀💀 b ur seriously if he’s reading this get help cause like ?? why you so angry 😭😭,DunkinDonuts,23
471,What drink should I try?,DunkinDonuts,5
472,$3 pumpkin spice latte,DunkinDonuts,4
473,sticker machine bugggginnn,DunkinDonuts,3
474,Nutty Pumpkin - anyone try this?,DunkinDonuts,5
475,Dunkin hates their customers and their money,DunkinDonuts,7
476,Apple Cider was tested in some markets last year - does anyone have it in their store?,DunkinDonuts,16
477,Dunkin' And Goldfish Launch New Limited Edition Goldfish Dunkin' Pumpkin Spice Grahams,DunkinDonuts,12
478,My local go-to Dunkin for work just started skimping when I order with less ice 😔,DunkinDonuts,16
479,Anyone else got this offer? Also is 100 points monday coming back?,DunkinDonuts,12
480,"Nothing fancy, but it’s my classic breakfast",DunkinDonuts,8
481,"Why do I keep coming back shitty taste, not as pictured &amp; the same price as starbs",DunkinDonuts,17
482,what drink closely resembles the frozen coffee?,DunkinDonuts,7
483,what happened to 100 bonus points on mobile Monday,DunkinDonuts,9
484,I only need dunkin. It's just amazing,DunkinDonuts,8
485,“Strawberry” coconut milk refresher… where’s the strawberry? 😭,DunkinDonuts,8
486,I am extremely disappointed with the new fall refresher,DunkinDonuts,9
487,NEW? or Refreshed Dunkin Rewards Program now LIVE in California. Free any type drinks/size from 200 points are now 900 points. New rewards prices listed in comments.,DunkinDonuts,28
488,The pumpkin donut is nearly 400 calories,DunkinDonuts,7
